title,author,category,price,publicationYear,description,imageUrl
Khi Mọi Thứ Sụp Đổ - Lời Khuyên Chân Thành Trong Những Thời Điểm Khó Khăn,Pema Chodron,Sách tư duy - Kỹ năng sống,83300,2000,,https://salt.tikicdn.com/ts/product/a4/0c/35/823fe4a9069731cbd032f54341c6f999.jpg
Kingdom - Tập 36,Yasuhisa Hara,Kingdom - Tập 36,39100,2000,,https://salt.tikicdn.com/ts/product/82/ee/bc/22b922c89147f4bed1a5e3fcd1e3090e.jpg
Bá Tước Tiểu Thư - Tập 6,,Bá Tước Tiểu Thư - Tập 6,30000,2000,,https://salt.tikicdn.com/ts/product/e7/1f/3a/867008c3642c3fd6cfb3db0d8ebc9eb4.jpg
"Những Đêm Không Ngủ, Những Ngày Chậm Trôi",A Crazy Mind team,Truyện ngắn - Tản văn - Tạp Văn,55001,2000,,https://salt.tikicdn.com/ts/product/a8/e9/36/94bb68f3b55bb93a593fec97c087915f.jpg
Tâm Lý Học Tính Cách (Tặng Kèm: 1 Bookmark),Trâu Hoành Minh,Sách tư duy - Kỹ năng sống,66580,2000,,https://salt.tikicdn.com/ts/product/c7/3e/8f/02e2c44c07027bc8f9a6670edd6c63f6.jpg
Sách Tâm Lý Dành Cho Người Nhạy Cảm,Hiroko Mizushima,Sách tư duy - Kỹ năng sống,62001,2000,,https://salt.tikicdn.com/ts/product/db/49/dd/ee074a7fa1f25b879c7759fd97c002ca.jpg
Đọc Nhiều Nhớ Được Bao Nhiêu?,Zion Kabasawa,Sách kỹ năng làm việc,79000,2000,,https://salt.tikicdn.com/ts/product/31/75/42/edec5115f48cad11e3337945e707697a.jpg
Bí Quyết Tìm Kiếm Mặt Bằng Kinh Doanh - Đến Sahara Mở Quán Trà Đá - Bộ Sách Khởi Nghiệp Bán Lẻ,,Sách kỹ năng làm việc,158400,2000,,https://salt.tikicdn.com/ts/product/a4/58/46/ce9ebae3b41660fca6f08347d22b5a7d.png
Hạnh Phúc Là Con Đường,Hà Vĩnh Thọ,Truyện ngắn - Tản văn - Tạp Văn,93000,2000,,https://salt.tikicdn.com/ts/product/06/ed/f7/8d9de8007c05a442588005f1079948c6.jpg
Còn chút gì để nhớ (Tái Bản 2022),Nguyễn Nhật Ánh,Truyện ngắn - Tản văn - Tạp Văn,29800,2000,,https://salt.tikicdn.com/ts/product/5d/33/2f/c9f34abe1b95dd67a364bf72c54bad29.jpg
Chắc Gì Ta Đã Yêu Nhau (Tái Bản 2022),Minh Nhật,Truyện ngắn - Tản văn - Tạp Văn,70200,2000,,https://salt.tikicdn.com/ts/product/c0/8a/4e/d599ef5ae814777eb05e9479c255f48f.jpg
Đừng Cố Làm Người Tốt Trong Mắt Tất Cả Mọi Người,,Sách tư duy - Kỹ năng sống,93000,2000,,https://salt.tikicdn.com/ts/product/2b/fe/2f/0635da3b37fbb52a00b822dcd0ea9d55.png
Thấu hiểu Hành vi giá Thị trường Tài chính (Understanding Price Action),,"Sách tài chính, tiền tệ",367000,2000,,https://salt.tikicdn.com/ts/product/9e/af/6e/9a9759a30fe7d13c5d8fbaaf2535c17a.jpg
Kỳ Nữ Gò Ôn Khâu,Hoài Điệp Thứ Lang,Tiểu Thuyết,102000,2000,,https://salt.tikicdn.com/ts/product/ce/42/4a/7c9328343c11af93db78f31fbf145c75.jpg
Kaguya-Sama: Cuộc Chiến Tỏ Tình - Tập 5,Aka Akasaka,Kaguya-Sama: Cuộc Chiến Tỏ Tình - Tập 5,39100,2000,,https://salt.tikicdn.com/ts/product/e1/7b/77/d9f4e7d06a6671b98a2a532c5a3f85fe.jpg
Gia Định Là Nhớ - Sài Gòn Là Thương,Cù Mai Công,Lịch Sử Việt Nam,77800,2000,,https://salt.tikicdn.com/ts/product/9a/ee/2a/1f2c3c626399a3e4d869c8f5bc904faa.jpg
GIẢI MÃ HÀNH VI ĐỌC VỊ CẢM XÚC,,Sách tư duy - Kỹ năng sống,83000,2000,,https://salt.tikicdn.com/ts/product/fc/9c/e6/5751e6e758cfc22ff66f822279f770f0.PNG
"Vivre Card - Thẻ Dữ Liệu Nhân Vật One Piece Booster Pack - Những Kẻ Thực Thi ""Chính Nghĩa Hắc Ám""! CP9!!",Eiichiro Oda,"Vivre Card - Thẻ Dữ Liệu Nhân Vật One Piece Booster Pack - Những Kẻ Thực Thi ""Chính Nghĩa Hắc Ám""! CP9!!",25000,2000,,https://salt.tikicdn.com/ts/product/7a/5f/cf/6ca5c82cfd7fceff8896d435402cdd37.jpg
"""Cậu"" Ma Nhà Xí Hanako - Tập 0",,"""Cậu"" Ma Nhà Xí Hanako - Tập 0",28000,2000,,https://salt.tikicdn.com/ts/product/54/76/61/87926358b98b2af062a8f6d128f18103.jpg
Kinh Doanh - Khái Lược Những Tư Tưởng Lớn,DK,Bài học kinh doanh,262000,2000,,https://salt.tikicdn.com/ts/product/68/d0/66/a41413b3275041668fc3ae9b08599508.jpg
Combo 4 Cuốn Bộ Sách: Nuôi Con Không Phải Là Cuộc Chiến (Tái Bản),"Mẹ Ong Bông, Hachun Lyonnet, Bubu Hương",Sách Làm Cha Mẹ,333200,2000,,https://salt.tikicdn.com/ts/product/09/a0/90/1b1720aad43cdf30a74df18fb95819f4.jpg
Những Đòn Tâm Lý Trong Bán Hàng (Tái Bản),Brian Tracy,Sách Marketing - Bán hàng ,91100,2000,,https://salt.tikicdn.com/ts/product/70/bf/c3/7b3f81c1c024324c7e10a9d70275eee7.jpg
Làm sao dừng lại thời gian,Matt Haig,Tiểu Thuyết,142000,2000,,https://salt.tikicdn.com/ts/product/12/94/cf/fab1bdde0318dec16055cd26ed10096a.jpg
Tâm Lý Học Về Rối Loạn Nhân Cách Tránh Né,Okada Takashi,Sách tư duy - Kỹ năng sống,90001,2000,,https://salt.tikicdn.com/ts/product/0d/1c/b4/196da980d613562fd7ac11bb93d1fe51.jpg
Làm giàu từ chứng khoán bằng phương pháp VSA chính gốc: Nghiên cứu chuyên sâu về cách giao dịch của Wyckoff,Rubén Villahermosa Chaves,"Sách tài chính, tiền tệ",499000,2000,,https://salt.tikicdn.com/ts/product/05/4e/5c/3678985f9e4849b14700f086aa70bb3a.jpg
Triệu Phú Khu Ổ Chuột,Vikas Swarup,Truyện ngắn - Tản văn - Tạp Văn,75600,2000,,https://salt.tikicdn.com/ts/product/93/9c/a3/6d9d5a19282142216d376cc3b67eff54.jpg
Bé Tô màu - Combo 11 cuốn,,Tô màu - Luyện chữ  ,61400,2000,,https://salt.tikicdn.com/ts/product/28/de/24/f45ee3882e600cf2bd1ee3de54fd5d80.jpg
Slam Dunk - Deluxe Edition - Tập 11,Takehiko Inoue,Slam Dunk - Deluxe Edition - Tập 11,60000,2000,,https://salt.tikicdn.com/ts/product/7e/36/60/42ed56e794c719a0e9924e460f4cba3b.jpg
Người Minh Họa,Ray Bradbury,Tiểu Thuyết,93500,2000,,https://salt.tikicdn.com/ts/product/c7/46/2a/b0b1fac2149bf0cb1adbb437c6d101b1.jpg
Tôi Quyết Định Sống Cho Chính Tôi (Tái Bản 2020),Kim Suhyun,Sách tư duy - Kỹ năng sống,53560,2000,,https://salt.tikicdn.com/ts/product/65/08/87/cb07a056cf783f24bb833c983a6941a1.jpg
Sự Trung Thực Của Xác Chết – Ghi Chép Của Một Nhà Pháp Y,Hajime Nishio,Sự Trung Thực Của Xác Chết – Ghi Chép Của Một Nhà Pháp Y,69300,2000,,https://salt.tikicdn.com/ts/product/f4/bc/14/c202a8b6953aebc2a4f38696aea7241e.jpg
Sách công thức TikTokk Ads 1000 đơn,,Sách Marketing - Bán hàng ,199000,2000,,https://salt.tikicdn.com/ts/product/f2/e4/00/37613a3c9e31503b2faaa4ec9c2d919c.jpg
Thân Gửi Sở Thú,Rod Campbell,Truyện kể cho bé,47400,2000,,https://salt.tikicdn.com/ts/product/6e/8f/49/13f94a46fa8a0cc203f90dcb7bb7ea95.jpg
Hong Tay Khói Lạnh (Tản Văn Nguyễn Ngọc Tư),Nguyễn Ngọc Tư,Truyện ngắn - Tản văn - Tạp Văn,43001,2000,,https://salt.tikicdn.com/media/catalog/producttmp/2a/82/ed/6841c1fd1f6c42853da9214e0ac588bd.jpg
Husky Và Sư Tôn Mèo Trắng Của Hắn - Tập 4,Nhục Bao Bất Cật Nhục,Truyện đam mỹ,119000,2000,,https://salt.tikicdn.com/ts/product/e6/33/e0/0486c904f310c3249eac5f73f7c2865d.jpg
Khởi Nghiệp Bán Lẻ - Bí Quyết Thành Công Và Giàu Có Bằng Những Cửa Hàng Đông Khách - Công Thức Kinh Doanh Và Quản Lý Cửa Hàng Hiệu Quả,Trần Thanh Phong,Sách khởi nghiệp,117000,2000,,https://salt.tikicdn.com/ts/product/4c/01/02/053782f7f7d58a2023d5406663f5180a.png
Đọc Vị Mọi Vấn Đề Của Trẻ - Giải Mã Mọi Vấn Đề Về Nuôi Con Nhỏ: Ăn - Ngủ - Kỷ Luật Hành Vi (Tái Bản),Tracy Hogg,Sách Làm Cha Mẹ,139300,2000,,https://salt.tikicdn.com/ts/product/67/b2/fa/6f314105fd1bdc7431fa278d580dc339.jpg
Hội Chứng E,Franck Thilliez,Truyện trinh thám,107400,2000,,https://salt.tikicdn.com/ts/product/97/33/93/91d41c482121a3d37803c341087dc9b7.jpg
Đau – Sự Cứu Rỗi Nơi Tận Cùng Đau Thương,Tôn Tần,Truyện trinh thám,119000,2000,,https://salt.tikicdn.com/ts/product/6c/fb/6b/46c65e5ef1a90a9c12231700e26944cd.jpg
Những Kẻ Xuất Chúng (Tái Bản),Malcolm Gladwell,Sách kinh tế học,105000,2000,,https://salt.tikicdn.com/ts/product/74/01/53/2fd820f97ed68509c207df6376b81249.jpg
Đấng cứu thế,Jo Nesbø,Truyện trinh thám,175001,2000,,https://salt.tikicdn.com/ts/product/d8/39/9c/6a9ff77726165f6ddbf7e6ba30d7a775.jpg
Sự An Ủi Của Triết Học,Alain de Botton,Triết Học,65400,2000,,https://salt.tikicdn.com/ts/product/f3/5d/b2/4bb1e2c5e2d544d06c33079479b58e22.jpg
CCMR. Phải Trái Đúng Sai,Michael Sandel,Sách tư duy - Kỹ năng sống,97100,2000,,https://salt.tikicdn.com/ts/product/40/bf/63/980deeb76442bca207341dc948e2022c.jpg
Tâm Lý Học Giải Mã Tình Yêu,Logan Ury,Lĩnh vực khác,85600,2000,,https://salt.tikicdn.com/ts/product/8d/7f/b1/edb4d762b131d9cea4b685f6264b5b6d.png
Sách: 1 Ngày Bằng 48 Giờ - Sổ tay Quản Lí Thời Gian Hiệu Quả ,Instant Research Institude,Sách tư duy - Kỹ năng sống,53500,2000,,https://salt.tikicdn.com/ts/product/02/4f/26/6e55aa0ef5e8191b7a58d6069bf5b3ed.jpg
Đừng Lựa Chọn An Nhàn Khi Còn Trẻ (Tái Bản),Cảnh Thiên,Sách tư duy - Kỹ năng sống,69000,2000,,https://salt.tikicdn.com/ts/product/c9/19/bb/f38df394d296929b86b49a72ca89a12e.jpg
Lịch Sử Cái Đẹp,Vĩ Ngư,Lĩnh vực khác,275400,2000,,https://salt.tikicdn.com/ts/product/dc/50/b0/5f39c9eb5586964461ef8d374e1e8484.jpg
Giáo Trình Chuẩn HSK 1 - Bài Học (Kèm file MP3),Khương Lệ Bình,Sách Học Tiếng Hoa,136600,2000,,https://salt.tikicdn.com/ts/product/92/37/db/3e0bd4d2f16e4e5fa8d1c8cc59b55506.jpg
"Tình Đầu Chọn Tôi, Tôi Rất Ngọt",Thụy Mang,Truyện đam mỹ,125000,2000,,https://salt.tikicdn.com/ts/product/38/50/f2/d663f97d3f49932cbd5a0fd9c31cec83.jpg
Bạn Không Thông Minh Lắm Đâu (Tái Bản)(Tặng kèm Bookmark),David McRaney,Sách tư duy - Kỹ năng sống,118000,2000,,https://salt.tikicdn.com/ts/product/53/ec/cf/cee2670564510b7c646c6c3bf03c5bf5.jpg
Miếng Ngon Hà Nội (Việt Nam Danh Tác),Vũ Bằng,Tiểu Thuyết,42000,2000,,https://salt.tikicdn.com/ts/product/6e/64/b5/0dfef9dbaf85a85f2f7038ceed68e0cc.jpg
"Chúng Ta Sống, Là Vì…?",Nguyễn Phong Việt,Truyện ngắn - Tản văn - Tạp Văn,79000,2000,,https://salt.tikicdn.com/ts/product/5a/7b/26/c35d1758256972abe139f7dde3c42cf6.png
Tớ Muốn Ăn Tụy Của Cậu,Sumino Yoru,Tiểu Thuyết,57600,2000,,https://salt.tikicdn.com/ts/product/90/c4/cd/d4f85346e6b17cf2f40bea1d36c8d543.jpg
Montessori – Phương Pháp Giáo Dục Toàn Diện Cho Trẻ 0-6 Tuổi,Ito Mika,Sách Làm Cha Mẹ,84000,2000,,https://salt.tikicdn.com/ts/product/b8/bb/00/d0c7aaa2f74d54070598ce279fa0f99e.jpg
Clean Code – Mã Sạch Và Con Đường Trở Thành Lập Trình Viên Giỏi,Robert Cecil Martin,Sách tư duy - Kỹ năng sống,303000,2000,,https://salt.tikicdn.com/ts/product/d0/17/b6/eebfb0d12e13ec120448f84e669a4f11.jpg
Nếu Em Không Phải Giấc Mơ (Tái Bản),Marc Levy,Tiểu Thuyết,53400,2000,,https://salt.tikicdn.com/ts/product/7f/b3/dd/ea7881f057a71f637bbb7449b69f7754.jpg
Black Jack - Tập 13 (Bìa Mềm),Osamu Tezuka,Black Jack - Tập 13 (Bìa Mềm),26100,2000,,https://salt.tikicdn.com/ts/product/50/28/1a/950e5ca1065b896a547f067d23089620.jpg
Nhảy Nhảy Nhảy (Tái Bản),Haruki Murakami,Truyện Giả tưởng - Huyền Bí - Phiêu Lưu,101400,2000,,https://salt.tikicdn.com/ts/product/a0/3a/ef/c1efb6857cfae62505d79ab026cc4054.jpg
Nghệ Thuật Giao Tiếp Để Thành Công (Tái Bản 2019),Leil Lowndes,Sách tư duy - Kỹ năng sống,111000,2000,,https://salt.tikicdn.com/ts/product/f9/92/90/b48d511f27288fe28df633e5ea4911cf.jpg
Migi & Dali - Tập 6,Nami Sano,Migi & Dali - Tập 6,38100,2000,,https://salt.tikicdn.com/ts/product/4a/a6/1a/c1f8717e9ec491f1b3a83b0dfc87a4b6.jpg
Trở Về Từ Cõi Sáng (Tái Bản),Nguyên Phong,Sách tư duy - Kỹ năng sống,64600,2000,,https://salt.tikicdn.com/media/catalog/producttmp/4f/e8/a1/c5199b53371791ba5470cba2aa70b8ab.jpg
"Bố Xấu, Bố Tốt",David Walliams,Văn học thiếu nhi,101000,2000,,https://salt.tikicdn.com/ts/product/48/d2/d2/4833023359d3095c22874f8deeb13f55.jpg
Miền Đất Hứa - Barack Obama (Bìa Cứng),Barack Obama,Tiểu sử - Hồi ký,338001,2000,,https://salt.tikicdn.com/media/catalog/producttmp/02/bd/ac/478941003fc6487dc2049e2f5f2f3e3a.jpg
Atlas Giải Phẫu Cơ Thể Người,BS. Alice Roberts,Atlas Giải Phẫu Cơ Thể Người,544000,2000,,https://salt.tikicdn.com/media/catalog/product/1/_/1._atlas_giai_phau_nguoi.jpg
Đọc Vị Bất Kỳ Ai (Tái Bản 2019),TS. David J. Lieberman,Sách tư duy - Kỹ năng sống,55300,2000,,https://salt.tikicdn.com/ts/product/42/a2/bf/ee69391ec908fc263af39a3a32983706.jpeg
Biểu Tượng Thất Truyền (Tái Bản 2020),Dan Brown,Truyện trinh thám,155000,2000,,https://salt.tikicdn.com/ts/product/26/c2/37/d755b97be5fdf04d7326f08c71847513.jpg
Nhân tố Enzyme - Phương Thức Sống Lành Mạnh (Tái Bản 2019),Hiromi Shinya,Nhân tố Enzyme - Phương Thức Sống Lành Mạnh (Tái Bản 2019),62300,2000,,https://salt.tikicdn.com/ts/product/fa/d3/66/073eaa1733569ac02c3984990089fc0d.jpg
SIGNS Thông Điệp Bí Ẩn Từ Vũ Trụ,Laura Lynne Jackson,Lĩnh vực khác,95400,2000,,https://salt.tikicdn.com/ts/product/c2/c4/40/59fe4d7eca161347b85eb5166c8950aa.png
Vua Sáng Chế Tập 23,Tatsuki Nohda,Vua Sáng Chế Tập 23,20000,2000,,https://salt.tikicdn.com/ts/product/87/b8/78/f300ec5fefe5459b40090d63273f4ab0.jpg
Infinite Dendrogram 3 - Đại Chiến Siêu Cấp,Kaidou Sakon,Light novel,78000,2000,,https://salt.tikicdn.com/ts/product/b1/c7/97/c1eda81ba4acbdc80316991d233a96ba.jpg
Nhân Duyên Tiền Kiếp,,Nhân Duyên Tiền Kiếp,195000,2000,,https://salt.tikicdn.com/ts/product/12/12/90/21d482d8a69ed6e77d2ab3b232ca7159.jpg
RIO Book No.3 - Hình Ảnh Điều Khiển Tâm Trí - 33 Kỹ Thuật Điều Khiển Tâm Lý Trong Truyền Thông Thị Giác,Andrews - Van leeuwen - Van Baaren ,Sách Marketing - Bán hàng ,108500,2000,,https://salt.tikicdn.com/ts/product/4b/0c/87/40e137565d61b3c3504e53afc43265e9.jpg
Nước Ép Trị Liệu Và Chế Độ Ăn Theo Phương Pháp Cơ Thể Tự Chữa Lành,Emma Phạm,Nước Ép Trị Liệu Và Chế Độ Ăn Theo Phương Pháp Cơ Thể Tự Chữa Lành,139300,2000,,https://salt.tikicdn.com/ts/product/ce/03/a6/03cea0cb853c06293f9e178896b50f6c.jpg
Rừng Sâu Tăm Tối,Ruth Ware,Tiểu Thuyết,156750,2000,,https://salt.tikicdn.com/ts/product/ae/8a/c9/60457050a34cad60febda55f02bc0285.jpg
Vô Thường,Nguyễn Bảo Trung,Truyện ngắn - Tản văn - Tạp Văn,52000,2000,,https://salt.tikicdn.com/ts/product/51/cf/19/024f4bacf6c38c06fb537dc41cced5ad.jpg
Trải Nghiệm Khách Hàng Xuất Sắc,Nguyễn Dương,"Sách quản trị, lãnh đạo",167500,2000,,https://salt.tikicdn.com/ts/product/1c/fb/b8/f924b4eff4598c5fc7b511be448caa95.jpg
Tiệm Bá Nghệ Tada Trước Ga Mahoro,Miura Shion,Tiểu Thuyết,72000,2000,,https://salt.tikicdn.com/ts/product/22/48/d1/b4f5f0fa9a8394d02b021c1557ed99ae.jpg
Làm Sao Học Ít Hiểu Nhiều,Zion Kabasawa,Sách tư duy - Kỹ năng sống,85700,2000,,https://salt.tikicdn.com/ts/product/6d/af/9c/55a1d35282f15a0d0b9ce65879d946b1.png
Thiền Sư Và Em Bé 5 Tuổi,Thích Nhất Hạnh,Thiền Sư Và Em Bé 5 Tuổi,80400,2000,,https://salt.tikicdn.com/ts/product/40/50/4f/c66154af241f021f345fb3c53a70f57d.jpg
Komi - Nữ Thần Sợ Giao Tiếp Tập 15,Tomohito Oda,Komi - Nữ Thần Sợ Giao Tiếp Tập 15,23100,2000,,https://salt.tikicdn.com/ts/product/8d/1b/d9/774fd3a4ff41ac77a9ef71f60027927f.jpg
Bay Trên Tổ Chim Cúc Cu (Tái Bản),Ken Kesey,Truyện dài,70800,2000,,https://salt.tikicdn.com/ts/product/a9/ab/1d/a621797c725c3f6ed04c957dec333a50.jpg
Trở Về Không - Trải Nghiệm Ho'oponopono - Thực Hiện Hóa Những Phép Màu Trong Cuộc Sống,Joe Vitale,Sách tư duy - Kỹ năng sống,107200,2000,,https://salt.tikicdn.com/ts/product/ba/c3/dd/5727b66b1f6101d87ae956e32ee1650b.jpg
Minh Triết Trong Đời Sống (Tái Bản),Darshani Deane,Sách tư duy - Kỹ năng sống,71200,2000,,https://salt.tikicdn.com/media/catalog/producttmp/b0/d2/e1/5ab40fd6e45ff9c1bcbb67867f8ef022.jpg
Đặc Quyền Của Gái Hư,Kara King,Sách tư duy - Kỹ năng sống,67100,2000,,https://salt.tikicdn.com/ts/product/15/f5/60/17597afdd03ec3b704ab0d7f005a19a1.jpg
Những Nguyên Tắc Đạo Đức Trong Giáo Dục,John Dewey,Sách tư duy - Kỹ năng sống,50000,2000,,https://salt.tikicdn.com/ts/product/b7/01/2c/cab251d6c4aa9aae75530430e0515227.jpg
Chú Thuật Hồi Chiến - Tập 7,,Chú Thuật Hồi Chiến - Tập 7,30000,2000,,https://salt.tikicdn.com/ts/product/6b/98/82/8d6ef80eb54c5fb1e2d8f6e74de9ca6c.jpg
"Súng, Vi Trùng Và Thép",Jared Diamond,Kiến Thức Bách Khoa,194000,2000,,https://salt.tikicdn.com/ts/product/e1/19/fe/ca5bbc6af530dfb61b319ad9200b33ab.jpg
Thám Tử Lừng Danh Conan - Tập 100 - Bìa Gập - Tặng Kèm Postcard Vuông Conan 100,Gosho Aoyama,Thám Tử Lừng Danh Conan - Tập 100 - Bìa Gập - Tặng Kèm Postcard Vuông Conan 100,20000,2000,,https://salt.tikicdn.com/ts/product/86/f3/ba/989cb5a603f5d7ad1078cdae574b038c.jpg
Harry Potter và Hội Phượng Hoàng - Bản Màu Bìa Cứng,J.K. Rowling,Truyện Giả tưởng - Huyền Bí - Phiêu Lưu,1050700,2000,,https://salt.tikicdn.com/ts/product/4e/4f/ab/9901cdbc0d96d3c1152b124608355a22.jpg
Ảo Dạ (Tái Bản),Higashino Keigo,Truyện trinh thám,107400,2000,,https://salt.tikicdn.com/ts/product/9e/01/6f/a0bb7085a45d4cda06c7424c5288b35b.jpg
"Thiện, Ác Và Smart Phone (Tái Bản)",Đặng Hoàng Giang,Phóng sự - Ký sự - Bút ký,63000,2000,,https://salt.tikicdn.com/ts/product/ad/12/d9/b32db899a0c2cd01d4e6f5878ce993b4.jpg
Danh Gia Cổ Vật - Bí Ẩn Thanh Minh Thượng Hà Đồ,Mã Bá Dung,Truyện Giả tưởng - Huyền Bí - Phiêu Lưu,75000,2000,,https://salt.tikicdn.com/ts/product/dd/a3/d8/baeb9c8c72e7052cf82e81798f0ca2ad.jpg
Luật Hấp Dẫn - Quy Luật Về Sự Thịnh Vượng Và Thành Công,Prentice Mulford,Sách tư duy - Kỹ năng sống,83000,2000,,https://salt.tikicdn.com/ts/product/67/36/ef/eafef30d7bc5df494f7613c75e605aa3.png
Thông Điệp Của Nước (Tái Bản 2020),Masaru Emoto,Sách tư duy - Kỹ năng sống,62300,2000,,https://salt.tikicdn.com/ts/product/8c/c2/bb/4c42dfafcccf543a28268853299fc98c.jpg
Súng Săn,Yasushi Inoue,Tiểu Thuyết,31600,2000,,https://salt.tikicdn.com/ts/product/37/a7/c0/b37564d7964fcb9be6356073e9bf1a64.jpg
Muôn Kiếp Nhân Sinh 2,Nguyên Phong,Muôn Kiếp Nhân Sinh 2,176800,2000,,https://salt.tikicdn.com/media/catalog/producttmp/ae/be/1f/2d1524717e634872a1dc861020a70b2b.jpg
Văn Phòng Thám Tử Quái Vật - Tập 15,Sho Aimoto,Văn Phòng Thám Tử Quái Vật - Tập 15,26100,2000,,https://salt.tikicdn.com/ts/product/65/b8/95/8ef0893e9d03e1b3f9740891c2a47258.jpg
Vivre Card - Thẻ Dữ Liệu Nhân Vật One Piece Booster Pack - Kẻ Chi Phối Đáng Sợ! Gia Tộc Donquixote!!,,Vivre Card - Thẻ Dữ Liệu Nhân Vật One Piece Booster Pack - Kẻ Chi Phối Đáng Sợ! Gia Tộc Donquixote!!,24900,2000,,https://salt.tikicdn.com/ts/product/fe/ba/0e/ebde15d658bb546bfc1ad54cf0de69f5.jpg
Khi Hơi Thở Hóa Thinh Không,Paul Kalanithi,Tiểu sử - Hồi ký,68670,2000,,https://salt.tikicdn.com/media/catalog/product/k/h/khi-hoi-tho-hoa-thinh-khong.u5464.d20170726.t170655.288851.jpg
Bạn Đắt Giá Bao Nhiêu? (Tái Bản),Vãn Tình,Sách tư duy - Kỹ năng sống,94100,2000,,https://salt.tikicdn.com/ts/product/39/02/81/44315fecbd95af078d1abbdc359e1794.jpg
Y Học Dinh Dưỡng - Những Điều Bác Sĩ Không Nói Với Bạn,,Y Học Dinh Dưỡng - Những Điều Bác Sĩ Không Nói Với Bạn,110000,2000,,https://salt.tikicdn.com/ts/product/83/2e/c3/c5ae4fe0dab21acd452f4ac5e4a69128.jpg
Anh em phi hành gia - Tập 35,Chuya Koyama,Anh em phi hành gia - Tập 35,39100,2000,,https://salt.tikicdn.com/ts/product/3c/d4/ac/1e219fb1e145f693df1edaa57d958621.jpg
Storytelling With Data: Let’S Practice! - Thực Hành Kể Chuyện Thông Qua Dữ Liệu!,Cole Nussbaumer Knaflic,Sách kỹ năng làm việc,279000,2000,,https://salt.tikicdn.com/ts/product/3c/d7/33/63679b6e74378c4282ddd5534501c916.jpg
Trái Tim Của Brutus,Higashino Keigo,Truyện trinh thám,82800,2000,,https://salt.tikicdn.com/ts/product/a4/e4/fe/4d9a4d7f7ef61418698c1126858a0403.jpg
"Càng Mạnh Mẽ, Càng Dịu Dàng (Tái Bản)",Lý Ái Linh,Sách tư duy - Kỹ năng sống,64001,2000,,https://salt.tikicdn.com/ts/product/c9/32/14/6b2d50f1ace01d021d051d083d36feb4.jpg
"Gửi em, người bất tử - Tập 13",Yoshitoki Oima,"Gửi em, người bất tử - Tập 13",26100,2000,,https://salt.tikicdn.com/ts/product/6c/c1/61/3def09d07bdb93e8fb3c583c1ae273c8.jpg
Vì Con Gái Tôi Có Thể Đánh Bại Cả Ma Vương - Tập 6,CHIROLU,Light novel,101000,2000,,https://salt.tikicdn.com/ts/product/a6/1f/81/cd7c128b9d5e5eeb899031af373e6ba3.jpg
Dragon Ball Full Color - Phần Năm: Truy Lùng Cell Bọ Hung - Tập 5,Akira Toriyama,Dragon Ball Full Color - Phần Năm: Truy Lùng Cell Bọ Hung - Tập 5,70100,2000,,https://salt.tikicdn.com/ts/product/70/92/91/b43ed888c489e04cb2e0a9ee81ad7dd7.jpg
Một Trăm Cái Bóng,Hwang Jungeun,Tiểu Thuyết,52000,2000,,https://salt.tikicdn.com/ts/product/18/52/da/e45622ee97cad8aa71de727041abf746.jpg
"Gửi Bạn, Người Đã Kiệt Sức Vì Những Chịu Đựng Âm Thầm [Tặng Kèm: 1 Bookmark Daisy]",Geulbaewoo,Truyện ngắn - Tản văn - Tạp Văn,62001,2000,,https://salt.tikicdn.com/ts/product/d6/f2/82/762baed33a7738d12dd388e95002f369.jpg
Anh Em Phi Hành Gia - Tập 36,Chuya Koyama,Anh Em Phi Hành Gia - Tập 36,36000,2000,,https://salt.tikicdn.com/ts/product/99/ee/e3/ef17a669e205cb28c22d137f30bd17f3.jpg
8 Vụ Án Hoàn Hảo - Vạch Trần Tâm Lý Kẻ Phạm Tội,Peter Swanson,Sách tư duy - Kỹ năng sống,104000,2000,,https://salt.tikicdn.com/ts/product/56/9b/2a/d2e9df5c0087157ddbaa04dd66f39159.jpg
"Yêu Mình Trước Đã, Yêu Đời Để Sau",Vex King,Sách tư duy - Kỹ năng sống,70001,2000,,https://salt.tikicdn.com/ts/product/4f/d0/e7/304dc60d09641635b64a932b54ff54af.jpg
Tâm Lý Học Hẹn Hò - Nghệ Thuật Giao Tiếp Trong Tình Yêu,Nhiều tác giả,Sách tư duy - Kỹ năng sống,76001,2000,,https://salt.tikicdn.com/ts/product/83/e2/62/649a2a3335e07bc133cf1e8b5adc29f4.jpg
Gia Định Là Nhớ Sài Gòn Là Thương_FN,Cù Mai Công,Thơ,105000,2000,,https://salt.tikicdn.com/ts/product/82/87/62/69278f63e4a8a667c4c67c7a45c25e53.jpg
Tiểu Thuyết One Piece Film RED [Tặng Kèm Bìa Áo Và Poster Gập Sẵn Bên Trong],Eiichiro Oda,Tiểu Thuyết One Piece Film RED [Tặng Kèm Bìa Áo Và Poster Gập Sẵn Bên Trong],65000,2000,,https://salt.tikicdn.com/ts/product/4e/b3/7a/7aa1b8e0b2c4082fab0e1973f5b6830b.jpg
Cường Quốc Trong Tương Lai,Hamada Kazuyuki,Sách kinh tế học,74200,2000,,https://salt.tikicdn.com/ts/product/e0/4e/0d/8c5f132b21736262f12a5ee290554250.jpg
Mèo Và Triết Lý Nhân Sinh - Mèo Đã Dạy Chúng Ta Điều Gì Về Cuộc Sống,John Gray,Sách tư duy - Kỹ năng sống,137000,2000,,https://salt.tikicdn.com/ts/product/ef/cb/f4/767561983136b09005c54fc877189af3.jpg
Ikigami - Tập 10,Motoro MASE,Ikigami - Tập 10,39100,2000,,https://salt.tikicdn.com/ts/product/ca/c2/00/aa9668c548f92f586105a367264fb5c6.jpg
Yu-Gi-Oh! Gx Tập 3: Vòng Bảng Kết Thúc!! [Tặng Kèm Bookmark PVC],Kazuki Takahashi,Yu-Gi-Oh! Gx Tập 3: Vòng Bảng Kết Thúc!! [Tặng Kèm Bookmark PVC],29100,2000,,https://salt.tikicdn.com/ts/product/c9/a6/a7/3c649431f124d0646d38382303f72790.jpg
Bàn Về Khoa Học,Leon Tolstoy,Kiến Thức Bách Khoa,45000,2000,,https://salt.tikicdn.com/ts/product/f4/a8/dc/7da52979aa5c1533b74471e1b7de4e31.jpg
Blue Period - Tập 04,Yasuhisa Hara,Blue Period - Tập 04,38400,2000,,https://salt.tikicdn.com/ts/product/0b/47/a6/c0c6b79d8894219acaa53815f9ea9a22.jpg
Mùi hương - Tái Bản,Patrick Suskind,Tác phẩm kinh điển,69000,2000,,https://salt.tikicdn.com/ts/product/1b/a6/d3/07effba774f36348076d35092592b996.jpg
Hành Trình Của Linh Hồn (Tái Bản 2020),Michael Duff Newton,Hành Trình Của Linh Hồn (Tái Bản 2020),90300,2000,,https://salt.tikicdn.com/ts/product/d2/52/b5/b4c0bffcf1f5006a3420ac2ffd63e8f3.jpg
Pierre Và Jean,Guy De Maupassant,Tiểu Thuyết,53500,2000,,https://salt.tikicdn.com/ts/product/07/43/77/d40843de68c0ce87be09728722bd180e.jpg
"Cao Thủ ""Đổi Đen Thay Trắng"" - Tập 7",Phong Thư Lưu Ngốc,Truyện đam mỹ,159000,2000,,https://salt.tikicdn.com/ts/product/87/80/55/87d190955fb4ab5962c7332894a9c45c.jpg
Chữ Số Và Thế Giới - Nguồn Gốc Bị Lãng Quên,Đỗ Minh Triết,Lĩnh vực khác,107000,2000,,https://salt.tikicdn.com/ts/product/14/72/41/38147755c1fe42d4de8d2d4de3227a59.jpg
Nghĩ Thiện Để Cuộc Đời Và Công Việc Viên Mãn,Inamori Kazuo,Sách tư duy - Kỹ năng sống,56100,2000,,https://salt.tikicdn.com/ts/product/0d/30/92/e49d2293c601bb8db2164ee14f7a8f3e.jpg
Trí Thông Minh Của Sự Tinh Tế,Tô Mạn,Sách tư duy - Kỹ năng sống,63000,2000,,https://salt.tikicdn.com/ts/product/b8/d0/4d/e228d7481152597d9bbce83759866898.jpg
Đế Quốc Bóng Tối,Tiêu Đường Đông Qua,Truyện đam mỹ,160100,2000,,https://salt.tikicdn.com/ts/product/66/7e/08/af39c4a1469dd8233fb9b3c8081b9213.jpg
Điểm Đến Cuộc Đời,Đặng Hoàng Giang,Sách tư duy - Kỹ năng sống,54000,2000,,https://salt.tikicdn.com/ts/product/5b/f0/8f/b672b98a1944a98c87667497d5e18421.jpg
Đi Hát Karaoke Đi,Yama Wayama,Đi Hát Karaoke Đi,35001,2000,,https://salt.tikicdn.com/ts/product/64/75/30/6ddc9be10f3cc9685f811671cee6290f.jpg
