title,author,category,price,publicationYear,description,imageUrl
Phát Triển Trí Tuệ Cảm Xúc - Con Được Là Chính Mình!,Jayneen Sanders,Kiến thức - Bách khoa,30000,2000,,https://salt.tikicdn.com/ts/product/48/48/b8/bb9cca453793e3bcdb08981b4f1b0051.jpg
Combo Mindmap English Grammar và Mindmap English Vocabulary - Học Kèm App Online,The Windy,Sách Học Tiếng Anh,283000,2000,,https://salt.tikicdn.com/ts/product/0a/47/ff/f0a129bd8d8c9af9f8c894d48e9e04c6.jpg
Kinh Tế Học Vĩ Mô (2022),,Giáo Trình Đại Học - Cao Đẳng,288000,2000,,https://salt.tikicdn.com/ts/product/f1/31/4d/7f4eec5037978756b691ad1997e6f8fa.jpg
OSHO - Can Đảm Là Chính Mình Trong Thế Giới Hiểm Nguy,Osho,Sách tư duy - Kỹ năng sống,58000,2000,,https://salt.tikicdn.com/media/catalog/producttmp/2c/10/64/f116603f354b8a543e4d0f7a94d3cbbe.jpg
"Làm Đúng Việc, Xong Đúng Hạn",Damon Zahariades,Sách kỹ năng làm việc,59400,2000,,https://salt.tikicdn.com/ts/product/47/f7/56/5903fe4b97f1371842a9f82ccca5f7bc.jpg
Nha Sĩ Yêu Quái (Tái Bản 2020),David Walliams,Tiểu Thuyết,65400,2000,,https://salt.tikicdn.com/ts/product/55/9c/8e/fa9cd9dee6bf3871235fac195a4b891c.jpg
Thần Số Học: Thấu Hiểu Nhân Tâm,Tống Khánh Thượng,Sách Chiêm Tinh - Horoscope,76300,2000,,https://salt.tikicdn.com/ts/product/68/3f/47/0fc7c4b913ff75bb7b033ed039651a0c.jpg
Danh Gia Cổ Vật - Minh Nhãn Mai Hoa,Mã Bá Dung,Truyện Giả tưởng - Huyền Bí - Phiêu Lưu,126500,2000,,https://salt.tikicdn.com/ts/product/b4/34/cc/b21f8ec918507ed3f711547c56387b80.jpg
Pokémon - Cuộc Phiêu Lưu Của Pippi B.W (Black.White) - Tập 1,Kosaku Anakubo,Pokémon - Cuộc Phiêu Lưu Của Pippi B.W (Black.White) - Tập 1,22000,2000,,https://salt.tikicdn.com/ts/product/4f/05/ac/1ab923793c74625169c5362d72725694.jpg
Pokémon - Cuộc Phiêu Lưu Của Pippi B.W (Black.White) - Tập 2,Kosaku Anakubo,Pokémon - Cuộc Phiêu Lưu Của Pippi B.W (Black.White) - Tập 2,22000,2000,,https://salt.tikicdn.com/ts/product/7e/f3/76/fe361c27de50ea2be6da5cc9dda6a124.jpg
Cơ Thể Tự Chữa Lành - Thanh Lọc Để Phục Hồi,Anthony William,Cơ Thể Tự Chữa Lành - Thanh Lọc Để Phục Hồi,179001,2000,,https://salt.tikicdn.com/ts/product/22/67/43/c2b5da12ba401865663ab1577995f98a.jpg
Sách: Hài Hước Một Chút Thế Giới Sẽ Khác Đi (Tái Bản),Lưu Chấn Hồng,Sách tư duy - Kỹ năng sống,62000,2000,,https://salt.tikicdn.com/ts/product/2b/87/88/1e12c5924b455a5c60cd5156ec9f12ac.jpg
Việt Sử Yếu,Hoàng Cao Khải,Lịch Sử Việt Nam,176000,2000,,https://salt.tikicdn.com/ts/product/76/8d/23/5838245694b28ee07bede54d881fe337.jpg
Phòng Thiết Kế Khai Thiên Lập Địa – Tập 1 [Tặng Bookmark + Sticker],Hebi-zou,Phòng Thiết Kế Khai Thiên Lập Địa – Tập 1 [Tặng Bookmark + Sticker],36000,2000,,https://salt.tikicdn.com/ts/product/12/80/34/7469bfe242d9a2e11e2a662ecf7b26ae.jpg
Sách Lật Tương Tác Song Ngữ 0.3 Tuổi - Ú Òa,Giuliano Ferri,Kiến thức - Bách khoa,68000,2000,,https://salt.tikicdn.com/ts/product/c4/57/0e/04964a3618fa314cc8b051ac384fc1fe.jpg
Tư Duy Phản Biện,Zoe McKey,Sách kỹ năng làm việc,46750,2000,,https://salt.tikicdn.com/ts/product/6f/3f/58/80b2a6075864f509d332757b6bcfaac4.jpg
THE DAILY STOIC – 366 CHIÊM NGHIỆM VỀ TRÍ TUỆ VÀ LÒNG CAN TRƯỜNG CÙNG NGHỆ THUẬT SỐNG,Ryan Holiday,Sách nghệ thuật sống đẹp,156000,2000,,https://salt.tikicdn.com/ts/product/92/76/ca/511b35694faeba098b24fae54b2810b5.jpg
Thơ Xuân Diệu,Xuân Diệu,Thơ,30000,2000,,https://salt.tikicdn.com/ts/product/dc/11/4c/c3e1b9cba245d34d27e371df32f49a3e.jpg
Bánh Mì Kẹp Chuột (Tái Bản 2019),David Walliams,Truyện kể cho bé,47400,2000,,https://salt.tikicdn.com/ts/product/14/d2/bd/c5605fdef445b220cb8fd6c7fdcbd1cf.jpg
Đại Việt Sử Ký Toàn Thư Trọn Bộ (Tái Bản),Đào Duy Anh,Lịch Sử Việt Nam,166000,2000,,https://salt.tikicdn.com/ts/product/11/c7/19/ac3ba358ce4fcf31010baf1a7e1a8870.jpg
Việt Nam Danh Tác - Chân Trời Cũ,Hồ Dzếnh,Truyện ngắn - Tản văn - Tạp Văn,52000,2000,,https://salt.tikicdn.com/ts/product/56/5d/3a/6777845d0bf71913ea1a30b72dcabc4b.jpg
Những Nụ Hôn Điện Ảnh,Eric Fottorino,Tiểu Thuyết,52000,2000,,https://salt.tikicdn.com/media/catalog/product/n/h/nhung-nu-hon-dien-anh.jpg
Grimgar - Ảo Ảnh Và Tro Tàn Level.14 - [Parano_Mania],Ao Jyumonji,Grimgar - Ảo Ảnh Và Tro Tàn Level.14 - [Parano_Mania],72200,2000,,https://salt.tikicdn.com/ts/product/96/c0/63/eda9798b34e6fc4536acd74cff6dcfad.jpg
Làm Sao Học Hết Được Nhân Sinh,Pomnyun,Sách tư duy - Kỹ năng sống,101400,2000,,https://salt.tikicdn.com/ts/product/b0/24/e9/ce612a5526b7490400492b23ae3a14ad.jpg
EAT CLEAN Thực Đơn 14 Ngày Thanh Lọc Cơ Thể Và Giảm Cân,,Sách Nấu ăn,107000,2000,,https://salt.tikicdn.com/ts/product/c1/62/b1/f790ca4ca4e8ea52ba802c41ab7d6917.jpg
Gấu Pooh Xinh Xắn,A.A.Milne,Truyện kể cho bé,68000,2000,,https://salt.tikicdn.com/ts/product/10/81/03/df0f446352a84745559c241589b282e4.jpg
Combo Bộ 2 Cuốn: Giết Chỉ Huy Đội Kỵ Sĩ (Tập 1: Ý Tưởng Xuất Hiện + Tập 2: Ẩn Dụ Dịch Chuyển),Haruki Murakami,Tiểu Thuyết,303000,2000,,https://salt.tikicdn.com/ts/product/22/bb/6a/06740710d0809bae6267693185d0f457.jpg
Chuyện Tình Thanh Xuân Bi Hài Của Tôi Quả Nhiên Là Sai Lầm - Comic - Tập 1 - Tặng Postcard,Wataru WATARI,Chuyện Tình Thanh Xuân Bi Hài Của Tôi Quả Nhiên Là Sai Lầm - Comic - Tập 1 - Tặng Postcard,51300,2000,,https://salt.tikicdn.com/ts/product/7c/28/46/53a70639714856e58d38471a52abe914.jpg
2000 English Collocation and Idioms,Trang Anh,Sách Học Tiếng Anh,104000,2000,,https://salt.tikicdn.com/ts/product/e4/a7/2f/0b62e23ebea5d5d1a5e3409481e6bd69.png
Sự Cứu Chuộc Một Sát Thủ Kinh Tế,John Perkins,Bài học kinh doanh,85250,2000,,https://salt.tikicdn.com/ts/product/fc/7a/e1/e87ade78cfc1cca4a424e3a6dffcebf6.jpg
CHỈ MÌNH TÔI THĂNG CẤP (SOLO LEVELING TẬP 3),Chugong,Light novel,187000,2000,,https://salt.tikicdn.com/ts/product/77/d5/b2/4fa38e486266c5b2713fde9b88864ff1.jpg
Sách - Hành Trình Về Phương Đông (Bìa Mềm - Tái bản 2021) - First News,Baird T. Spalding,Sách tư duy - Kỹ năng sống,106650,2000,,https://salt.tikicdn.com/ts/product/2b/a9/0f/b99d7a7a5873ea8909c1a0786694bfd0.jpg
Lưu Thông Máu Tốt Hóa Giải Bách Bệnh,Akiyoshi Horie,Lưu Thông Máu Tốt Hóa Giải Bách Bệnh,69300,2000,,https://salt.tikicdn.com/ts/product/18/40/fe/26710076611357c1b02acbd8ba6fe7d4.jpg
Chữa Lành Năm Giác Quan,Park Ji Sook,Sách tư duy - Kỹ năng sống,82000,2000,,https://salt.tikicdn.com/ts/product/28/07/bd/88f5cc498d311d43302c636d8d048de8.png
Chuyện Kể Rằng Có Nàng Và Tôi,,Thơ,50001,2000,,https://salt.tikicdn.com/ts/product/94/e8/7f/a84830267c5f30b5c264507b1eaf724b.jpg
DragonBall - 7 viên ngọc rồng ( 1-42 ),,DragonBall - 7 viên ngọc rồng ( 1-42 ),19500,2000,,https://salt.tikicdn.com/ts/product/af/08/28/74c7a4dda999805c5b9f4e70bc0261f7.jpeg
Combo 2 Cuốn: Tâm Lý Học Tội Phạm,Stanton E. Samenow,Lĩnh vực khác,172800,2000,,https://salt.tikicdn.com/ts/product/b5/07/74/31377e044579aa03901b4df1c9ae90fe.jpg
Bộ Ehon song ngữ Anh Việt 10 cuốn - Cho bé 0-6 tuổi - Bộ sách nuôi dưỡng tâm hồn bé,,Truyện tranh Ehon,106000,2000,,https://salt.tikicdn.com/ts/product/08/26/71/1353597d75ad6b8a9bb276e1554904bd.jpg
Sách - 1111 - NHẬT KÝ SÁU VẠN DẶM TRÊN YÊN XE CÀ TÀNG - Trần Đặng Đăng Khoa - NXB Trẻ - bìa mềm,,Du ký,292500,2000,,https://salt.tikicdn.com/ts/product/71/63/fe/e31a21bf2ab9b623c5fd005b6a5c88cb.jpg
Minh Triết Trong Ăn Uống Của Phương Đông (Tái Bản),Ngô Đức Vượng,Sách tư duy - Kỹ năng sống,91000,2000,,https://salt.tikicdn.com/media/catalog/producttmp/ed/df/a7/c12991c848598c8d3dce8850ba5a2906.jpg
Bàn Có Năm Chỗ Ngồi (Tái Bản 2022),Nguyễn Nhật Ánh,Truyện ngắn - Tản văn - Tạp Văn,24800,2000,,https://salt.tikicdn.com/ts/product/55/62/d1/5e6e153fba0faa0d7297356a4855cc55.jpg
BỘ SÁCH THỰC HÀNH VÀ PHÁT TRIỂN TRÍ THÔNG MINH CẢM XÚC TUỔI TEEN | Dành cho các con từ 10 tuổi đến 18 tuổi ,Phan Hồ Điệp,Sách Kiến Thức - Kỹ Năng Cho Trẻ,590000,2000,,https://salt.tikicdn.com/ts/product/9f/95/c4/e8831db34f121239cfd1b9a5abd526d2.jpg
Điểm đến cuộc đời - Ấn bản giới hạn nhân dịp ra mắt phim điện ảnh,Đặng Hoàng Giang,Sách tư duy - Kỹ năng sống,70800,2000,,https://salt.tikicdn.com/ts/product/02/c4/18/315676d059242569de8747c4205e206a.jpg
Tô Màu Phát Triển Trí Não Bộ Cho Bé 1-3 Tuổi - Tập 1,,Tô màu - Luyện chữ  ,9600,2000,,https://salt.tikicdn.com/ts/product/e7/de/ae/5cc2f7735d14269276d1331061f0bf0c.jpg
"Tiền - Hiểu rõ hơn, kiếm tốt hơn và cho đi nhiều hơn",Rob Moore,"Sách tài chính, tiền tệ",130800,2000,,https://salt.tikicdn.com/ts/product/33/5c/e3/6f37e0f7da53b11d36bb45b6379b31ca.jpg
"Kinh tế học về Tiền, Ngân hàng và Thị trường Tài chính - Ấn bản thứ 12",Frederic S. Mishkin,"Sách tài chính, tiền tệ",888000,2000,,https://salt.tikicdn.com/ts/product/32/b2/0a/645d69219718f5a68e1024bb7b06f567.jpg
Men Chase Women Choose - Chuyện Tình Yêu Bạn Biết Được Bao Nhiêu?,Dawn Maslar,Sách tư duy - Kỹ năng sống,78100,2000,,https://salt.tikicdn.com/ts/product/21/e6/ca/98ef53b706e906c40db95a0ef644ce19.jpg
Toàn Thư Chiêm Tinh Học Nhập Môn,Joanna Martine Woolfolk,Sách Chiêm Tinh - Horoscope,234500,2000,,https://salt.tikicdn.com/ts/product/cb/22/67/8fe8931b78c751781e78c09852b00144.jpg
Tâm Lý Học Tình Yêu – Tình Yêu Của Bạn Giống Như Bạn,Jun Mee-kyung,Lĩnh vực khác,102000,2000,,https://salt.tikicdn.com/ts/product/8e/b6/cf/9fdbd91a2cb7155662a6173099522492.png
365 Ngày Thong Dong,Robin Sharma,Sách tư duy - Kỹ năng sống,109600,2000,,https://salt.tikicdn.com/ts/product/a2/41/f5/c2840b920a0b0c7c953dafbe04712dc2.jpg
Bộ Sách Khởi Nghiệp Kinh Doanh Online - Marketing và Bán Hàng Hiệu Quả Với Thương Mại Điện Tử Tại Việt Nam,,Sách khởi nghiệp,295000,2000,,https://salt.tikicdn.com/ts/product/e7/20/da/337839b1c11bd3d68d789fee1aa783bc.png
Tarot Toàn Thư - Đọc Vận Mệnh Qua Những Lá Bài,,Sách Chiêm Tinh - Horoscope,254600,2000,,https://salt.tikicdn.com/ts/product/05/6a/ce/876735609c5c9708674e302b7f1d47c6.jpg
Tập luyện cổ họng – 5 phút 1 ngày giúp kéo dài 10 năm tuổi thọ,Otani Yoshio,Tập luyện cổ họng – 5 phút 1 ngày giúp kéo dài 10 năm tuổi thọ,55300,2000,,https://salt.tikicdn.com/ts/product/98/51/14/174fce8cfb756e75f0844313ccc2f6fa.jpg
Một Chiến Dịch Ở Bắc Kỳ,Charles-Édouard Hocquard,Sách Địa Danh - Du Lịch,361000,2000,,https://salt.tikicdn.com/ts/product/f4/08/ec/8dd38862d961dc6db1d806df513f4c68.jpg
Sách-Tâm lý học thành công tái bản 2020,Carol S. Dweck,Sách tư duy - Kỹ năng sống,169000,2000,,https://salt.tikicdn.com/ts/product/35/00/8a/6c1e32dc6b860007e6027f2a632c14d5.jpg
Trầm Cảm Ẩn - Cách Thoát Khỏi Chủ Nghĩa Hoàn Hảo Đang Che Đậy Căn Bệnh Trầm Cảm Của Bạn,Margaret Robinson Rutherford,Sách tư duy - Kỹ năng sống,88000,2000,,https://salt.tikicdn.com/ts/product/62/99/25/dd4a7076550f534d2d5bcadb2d47904f.jpg
"Combo 2 Quyển: Thiên Tài Bên Trái, Kẻ Điên Bên Phải + Tâm Lý Học Tội Phạm: Phác Họa Chân Dung Kẻ Phạm Tội",Nhiều tác giả,Sách tư duy - Kỹ năng sống,219000,2000,,https://salt.tikicdn.com/ts/product/e5/96/11/1ae8ba3f650e66c4b1cc655e8e3c5034.jpg
BỘ BÀI DEER’S TAROT  - (Bộ bài & sách hướng dẫn),Deer Tarot,Sách Chiêm Tinh - Horoscope,335000,2000,,https://salt.tikicdn.com/ts/product/ab/cd/29/16dbf63c2eccdef2a48df9a891ed2308.jpg
BỘ SÁCH HỌC TIẾNG ANH lITTLE STORIES,Stacey Riches,Sách Học Tiếng Anh,435500,2000,,https://salt.tikicdn.com/media/catalog/producttmp/8b/da/30/53700cea53c4ccbe564c359727eadaef.jpg
Chữa Lành Nỗi Đau,Louise L.Hay,Sách tư duy - Kỹ năng sống,64600,2000,,https://salt.tikicdn.com/media/catalog/producttmp/fd/f9/02/8ed62747a2a52c6e707bcf468a41887d.jpg
Chân Dung Thật - Thấu Hiểu Khách Hàng Chỉ Bằng Những Cuộc Trò Chuyện,Adele Revella,Sách Marketing - Bán hàng ,171500,2000,,https://salt.tikicdn.com/ts/product/62/96/f2/d42e9d7e491f2d9f1acf07728afbd14c.jpg
Dế Mèn Phiêu Lưu Ký,Tô Hoài,Văn học thiếu nhi,117000,2000,,https://salt.tikicdn.com/ts/product/47/54/8e/30bac752bcca2beb34a3522990805aa1.jpg
Picture Book - Pong Pang: Sở Thú Của Bống Bang,Songkha,Kiến thức - Bách khoa,17500,2000,,https://salt.tikicdn.com/media/catalog/product/s/o/so-thu-cua-bong-bang-01.u5426.d20170829.t104445.730494.jpg
Tư Duy Logic (Tái Bản),Minori Kanbe,Sách tư duy - Kỹ năng sống,72000,2000,,https://salt.tikicdn.com/ts/product/41/0a/e2/92d8be8c47a54f951fa50769e8ea0ac2.jpg
Truyện Tranh Hi Pencil,,Tranh Truyện,45000,2000,,https://salt.tikicdn.com/ts/product/06/58/e0/bf4278e7c1dd7bae8b568a9a34bcc3a6.jpg
Hình Cảnh Mất Trí,Chan Ho Kei,Truyện trinh thám,78000,2000,,https://salt.tikicdn.com/ts/product/5f/2e/2a/3aa914d4b230d3b1bdaa493442b22b51.jpg
Chiến Tranh Tiền Tệ - Phần 5 - Tương lai của tiền tệ thế giới – Bình yêu trước giông bão - Song Hong Bing,,"Sách tài chính, tiền tệ",134500,2000,,https://salt.tikicdn.com/ts/product/48/26/5b/db43b8a5259a939ffa4ee598c6a636bc.jpg
"Ăn Chay, Sống Lành (40 Mâm Cơm Thuần Chay Dễ Nấu Giàu Dinh Dưỡng)",Dương Yến Nhi,Sách Nấu ăn,118001,2000,,https://salt.tikicdn.com/ts/product/d8/ac/aa/55790b35fa1443b68618617b32c1adeb.jpg
Tĩnh Lặng (Tái Bản Lần Thứ 11/2020),Thích Nhất Hạnh,Sách giáo dục,48300,2000,,https://salt.tikicdn.com/ts/product/f7/ce/36/9553863c86683205724ceb94b8997758.jpg
Tô Màu Phát Triển Não Bộ Cho Bé 1-5 Tuổi Tập 10,Phạm Ngọc Điệp,Tô màu - Luyện chữ  ,9600,2000,,https://salt.tikicdn.com/ts/product/4f/02/17/694783a9156081146eaa6c5e17072556.jpg
Dưới Hiên Nhà Bà Già Đọc Boyslove - 4,Tsurutani Kaori,Dưới Hiên Nhà Bà Già Đọc Boyslove - 4,49200,2000,,https://salt.tikicdn.com/ts/product/74/92/91/73694f3565baf60aa85f90314087bec4.jpg
Thư Tình Gửi Một Người (Trịnh Công Sơn) (Tái Bản),Trịnh Công Sơn,Truyện ngắn - Tản văn - Tạp Văn,130600,2000,,https://salt.tikicdn.com/ts/product/ca/b0/c5/28b1da173d850420235541957bb05d39.jpg
Thế Giới Quả Là Rộng Lớn Và Có Rất Nhiều Việc Phải Làm (Tái Bản),Kim Woo Choong,Sách tư duy - Kỹ năng sống,83500,2000,,https://salt.tikicdn.com/ts/product/b3/75/8e/9004a56d3d09053943db8ff13b760f00.jpg
Thế Giới Của Sophie (Tái Bản 2020),Jostein Gaarder,Tiểu Thuyết,114000,2000,,https://salt.tikicdn.com/ts/product/1e/39/63/bb002144a00fd1bae2c2820a2dd54595.jpg
Fibonacci Trading,Carolyn Boroden,"Sách tài chính, tiền tệ",299000,2000,,https://salt.tikicdn.com/ts/product/70/35/8a/8c58d4f3679cedb2f0e26ba3d70e26c5.jpg
Mai Nương Lệ Cốt,Thầy dòng Prévost,Tiểu Thuyết,75050,2000,,https://salt.tikicdn.com/ts/product/e7/33/d5/c2c066a28aecf28ab453845ba217ff4f.jpg
Những kẻ cuồng nhạc Musicophilia – Tales of music and the brain,Oliver Sacks,Truyện dài,170000,2000,,https://salt.tikicdn.com/ts/product/5a/f2/8f/5c24db0ab13fd6b8c01e3c62aa92a64d.jpg
Huyền Thuật Và Các Đạo Sĩ Tây Tạng (Tái Bản),Alexandra David Neel,Kiến Thức Bách Khoa,71200,2000,,https://salt.tikicdn.com/media/catalog/producttmp/99/f1/43/42383e8f476ded2e8bd443df41e3953f.jpg
Overlord 6 - Những Anh Hùng Vương Quốc (2),Maruyama Kugane,Light novel,128000,2000,,https://salt.tikicdn.com/ts/product/eb/ce/8d/21a4aeafa0b83bd1a836161bdb80c7e2.jpg
Biết Chính Mình,Nguyễn Hồng Huấn,Sách tư duy - Kỹ năng sống,59500,2000,,https://salt.tikicdn.com/ts/product/9b/93/fa/b3cca812a20efd0ec37f1fd7e8595fd4.jpg
Kế Hoạch Marketing Trên Một Trang Giấy (Những Chỉ Dẫn Dễ Hiểu Nhất Cho Một Kế Hoạch Marketing Thông Minh),Allan Dib,Sách Marketing - Bán hàng ,107000,2000,,https://salt.tikicdn.com/ts/product/26/7a/a6/cee8ae062535770a8e6c936091fe0c2b.jpg
Sách - Thao túng tâm lý - 1980BOOKS,Shannon Thomas,Sách tư duy - Kỹ năng sống,101000,2000,,https://salt.tikicdn.com/ts/product/2e/08/d1/2715352f31568fb8d8ad8e01bee667d9.jpg
Ghi Chép Giải Phẫu Tâm Lý Học Tội Phạm,Soo Jung Lee,Lĩnh vực khác,58521,2000,,https://salt.tikicdn.com/ts/product/2d/8e/06/2f45f66f97b4b17769107305f3a6d2ec.jpg
Yêu Trong Tỉnh Thức - Từ Bạn Đời Đến Bạn Đạo Tập 1,Tuệ An,Sách Hôn Nhân - Giới Tính,185000,2000,,https://salt.tikicdn.com/ts/product/3e/6e/49/404af11b899db78a5dc1852f3cd35c94.png
Chuyến Phiêu Lưu Diệu Kỳ Của Edward Tulane (Tái Bản),Bagram Ibatoulline,Văn học thiếu nhi,68000,2000,,https://salt.tikicdn.com/media/catalog/product/e/d/edwardtulane.u5465.d20170927.t100409.968407.jpg
"Cứ Khóc, Cứ Tan Vỡ Và Trưởng Thành",Yến Nhi,Truyện ngắn - Tản văn - Tạp Văn,53100,2000,,https://salt.tikicdn.com/ts/product/b1/ba/73/7f1af98058c5948c8e8f818dd307673b.jpg
Hàng Ma Tháp,Công Tử Hoan Hỉ,Truyện đam mỹ,146300,2000,,https://salt.tikicdn.com/ts/product/d8/60/d7/ae357b7d8aeeadd1a0f719256f223ec9.jpg
Combo Sách Tiếng hàn tổng hợp dành cho người Việt Nam - Sơ cấp 1 (Phiên bản 1 màu),.,Sách Học Tiếng Hàn,147400,2000,,https://salt.tikicdn.com/ts/product/6d/97/55/e27d30a15fd77db963dbd908dd2cb65e.jpg
Dòng Tiền Gắn Liền Lợi Nhuận,Mike Michalowicz,Bài học kinh doanh,92900,2000,,https://salt.tikicdn.com/ts/product/6b/36/a2/6fce18f6edcb81aad2c02a8f03a31cdd.jpg
Báo Cáo Tài Chính - Hướng Dẫn Từng Bước Hiểu Và Lập Báo Cáo Tài Chính,Thomas R. Ittelson,Sách kỹ năng làm việc,113700,2000,,https://salt.tikicdn.com/ts/product/3c/4e/eb/53406ee8096f44ed3217eac18220f0f1.jpg
"Gửi em, người bất tử - Tập 12",Yoshitoki Oima,"Gửi em, người bất tử - Tập 12",26000,2000,,https://salt.tikicdn.com/ts/product/71/1d/01/f60bc3e65351d2ceb69db9ea921785c6.jpg
Cách Sống (Tái Bản 2020),Inamori Kazuo,Sách nghệ thuật sống đẹp,59500,2000,,https://salt.tikicdn.com/ts/product/45/81/82/cb219da454a44ae67ad9b29c2a53dcca.jpg
Chinh Phục Mục Tiêu (Tái Bản 2019),Brian Tracy,Sách kỹ năng làm việc,64600,2000,,https://salt.tikicdn.com/ts/product/ab/41/2d/9348fcef22aaa9a8c30861bce089235e.jpg
Trồng Một Nụ Cười - Cùng Trẻ Thực Hành Chánh Niệm,Thích Nhất Hạnh,Trồng Một Nụ Cười - Cùng Trẻ Thực Hành Chánh Niệm,139300,2000,,https://salt.tikicdn.com/ts/product/2e/d6/48/64de8da436db529fdd125b1600a331a6.jpg
Thị Trấn Vắng Mình Tôi - 5,SANBE KEI,Thị Trấn Vắng Mình Tôi - 5,49200,2000,,https://salt.tikicdn.com/ts/product/e4/45/5c/65f574b4650da1e8441cb02678108aaa.jpg
Đọc Sách Cộng Hưởng,Watanabe Yasuhiro,Sách tư duy - Kỹ năng sống,46800,2000,,https://salt.tikicdn.com/ts/product/de/1f/e3/368d77eb57d9a8ae2da5577074d328a5.jpg
Trái cây đại chiến zombie - Vũ khí bí mật (22 tập lẻ tuỳ chọn),Kim Ba,Truyện tranh thiếu nhi,25600,2000,,https://salt.tikicdn.com/ts/product/9c/09/b5/dcf8d6de524bbe3d9badee8b092cec36.jpg
Bên Kia Đường Có Đứa Dở Hơi (Tái Bản),Wendelin Van Draanen,Tiểu Thuyết,53000,2000,,https://salt.tikicdn.com/ts/product/78/43/16/dc78068c1a4c4d3019cfcad6d34840ba.jpg
Tương Lai Sau Đại Dịch Covid,Jason Schenker,Lĩnh vực khác,70001,2000,,https://salt.tikicdn.com/ts/product/33/5d/bb/3cca555b4a10fa0d79d8d229c6110218.jpg
"Tashiro, Cậu Đúng Thật Là! - Tập 2",Yamada,"Tashiro, Cậu Đúng Thật Là! - Tập 2",92200,2000,,https://salt.tikicdn.com/ts/product/ca/ca/20/dcfeb280b3cad295569b57ebc7f8a7a2.jpg
Harry Potter Và Thế Giới Phép Thuật Nhiệm Màu,William Irwin,Harry Potter Và Thế Giới Phép Thuật Nhiệm Màu,100000,2000,,https://salt.tikicdn.com/ts/product/91/66/65/78efdc1c608a6db0414feb896e4ba70f.png
Combo Sách Học Tiếng Anh Little Stories 1 (5 Cuốn),Stacey Riches,Sách Học Tiếng Anh,217700,2000,,https://salt.tikicdn.com/ts/product/6d/fc/d6/e8894dc01db8f0b05476aec919b2aae9.jpg
Combo Spy x Family (7 tập),,Combo Spy x Family (7 tập),175000,2000,,https://salt.tikicdn.com/ts/product/78/de/51/cc299b53cfaa1744d598e7137b293ea8.jpg
Cơ Thể Tự Chữa Lành: Phục Hồi Tuyến Giáp,Anthony William,Cơ Thể Tự Chữa Lành: Phục Hồi Tuyến Giáp,115000,2000,,https://salt.tikicdn.com/ts/product/a7/d7/48/750d042da9a173418d6f199911c04dad.jpg
Bộ Truyện Tranh Gieo Hạt Cùng Vĩ Nhân (Tập 1-10),,Đạo đức - Kỹ năng sống,150000,2000,,https://salt.tikicdn.com/ts/product/f0/fe/b6/57aa0ec3f852dd842fb7a57fdf3e3f1a.jpg
Ai Lấy Miếng Pho Mát Của Tôi ? (Tái Bản),Spencer Johnson,Sách nghệ thuật sống đẹp,38700,2000,,https://salt.tikicdn.com/media/catalog/producttmp/69/00/e2/290d3a06e6b3d634ef02ea53c4d19b56.jpg
Nghệ Thuật Bán Hàng Của Người Do Thái (Tái Bản 2020),Yaniv Zaid,Sách Marketing - Bán hàng ,58000,2000,,https://salt.tikicdn.com/media/catalog/producttmp/54/b3/2b/19e701675121097c7b4d6596ba52cb04.jpg
Người Đàn Bà Trên Cầu Thang,Bernhard Schlinks,Tiểu Thuyết,57800,2000,,https://salt.tikicdn.com/media/catalog/product/n/g/nguoi-dan-ba-tren-cau-thang.u4972.d20170511.t161135.962219.jpg
Lạc Quan Tếu – Irrational Exuberance,Robert J. Shiller,"Sách tài chính, tiền tệ",299000,2000,,https://salt.tikicdn.com/ts/product/06/45/4a/07d1819dbdca996dfdf50177487538cb.jpg
Mô Hình Hồi Quy (Tái Bản 2022),Nguyễn Văn Tuấn,Sách kỹ năng làm việc,89700,2000,,https://salt.tikicdn.com/ts/product/a3/53/41/22dbd1068f41b898f610b1afed7652db.jpg
Triết Lý Kinh Doanh Của Kyocera (Bìa Cứng),Inamori Kazuo,Bài học kinh doanh,122500,2000,,https://salt.tikicdn.com/ts/product/ca/ac/4c/ef79f9f202258eac99d663b7b1c2e672.jpg
Bản đặc biệt Tổng ôn 30 chuyên đề ngữ pháp tiếng anh cô Trang anh 2023,,Sách Học Tiếng Anh,199000,2000,,https://salt.tikicdn.com/ts/product/22/47/b7/cb47971fa8426602cff29025e73dd955.jpg
Sách - Sức Mạnh Của Sự Trầm Lắng - First News,Dr. Joseph Murphy,Sách tư duy - Kỹ năng sống,115200,2000,,https://salt.tikicdn.com/ts/product/04/5d/a5/eef2330b2a9c1cec6984a981ebbe3c98.png
Hôm nay chơi gì với con?,Nguyễn Hữu Hưng (chủ biên),Sách giáo dục,285000,2000,,https://salt.tikicdn.com/ts/product/1c/94/15/9639b7d9a135d8d96988e5bb149f9cc1.jpg
Combo Sách Thành thạo Tin học văn phòng ,,Tin Học Văn Phòng,260000,2000,,https://salt.tikicdn.com/ts/product/83/3f/ca/c154f6b0b145595b2c7b0ad70ab6fcf7.jpg
Bàn Về Văn Minh,Fukuzawa Yukichi,Sách Phong Tục - Tập Quán,83400,2000,,https://salt.tikicdn.com/ts/product/21/f6/e4/b6cbdc8a9cc93362f56e5a4b0447e271.jpg
Khéo Ăn Nói Sẽ Có Được Thiên Hạ (Bìa Cứng),Trác Nhã,Sách kỹ năng làm việc,100000,2000,,https://salt.tikicdn.com/ts/product/22/a9/48/0c3a79227ba92104f59c3a90238e9129.jpg
 Cứ Làm Đi!,,Sách tư duy - Kỹ năng sống,68000,2000,,https://salt.tikicdn.com/ts/product/cd/02/31/eba981af66290c9bed430295130dca10.jpg
Doraemon Movie Story: Nobita Và Viện Bảo Tàng Bảo Bối,Fujiko F Fujio,Doraemon Movie Story: Nobita Và Viện Bảo Tàng Bảo Bối,29000,2000,,https://salt.tikicdn.com/ts/product/dc/d3/e8/bbbed9f32911f29dbd92ee631e5d6ea5.jpg
Giải Mã Siêu Trí Nhớ ,Mai Tường Vân,Sách tư duy - Kỹ năng sống,139000,2000,,https://salt.tikicdn.com/ts/product/cb/40/a4/76472b72290c1ebb7af77e3120906087.jpg
Bí Quyết Đọc Sách 2.000 Từ/Phút ,Aloha Tuấn,Sách kỹ năng làm việc,286000,2000,,https://salt.tikicdn.com/ts/product/6f/b2/22/a4641e7018cea7d1f48935785bd93d91.png
"Lịch Sử Văn Minh Thế Giới - Phần IV “Thời Đại Đức Tin”, Tập 1: Byzantium Thời Tuyệt Đỉnh Lịch Sử Văn Minh Thế Giới",Will Durant,Lịch Sử Thế Giới,138450,2000,,https://salt.tikicdn.com/ts/product/d0/a0/6a/b9dc2d4bcbcfeb1602d81ae844bef8db.jpg
Shaman King - Tập 18,Hiroyuki Takei,Shaman King - Tập 18,30400,2000,,https://salt.tikicdn.com/ts/product/9e/e7/8e/c340c2e18a7c8673c5e1f62a7748ae06.jpg
Cho Tôi Xin Một Vé Đi Tuổi Thơ (Bìa Mềm) (Tái Bản),Nguyễn Nhật Ánh,Truyện dài,57700,2000,,https://salt.tikicdn.com/ts/product/8f/63/5d/e17ddc42fbf8bf15b1958222ed1939dc.jpg
Nỗi Đau Của Chàng Werther (Bìa Cứng),Johann Wolfgang von Goethe,Tiểu Thuyết,65300,2000,,https://salt.tikicdn.com/ts/product/2b/4f/1f/e4abb6516f492fe752dda4c0ecbeaf2a.jpg
Những Tấm Lòng Cao Cả (Bìa Cứng)(Tái Bản 2020),Edmondo De Amicis,Tác phẩm kinh điển,76800,2000,,https://salt.tikicdn.com/ts/product/1d/cd/8e/07836eb000d6dc2d955d841038a1c5ea.jpg
Bồi Thẩm Cuối Cùng,John Grisham,Truyện trinh thám,111000,2000,,https://salt.tikicdn.com/ts/product/87/2e/ab/f7ba2468a860beef485e7fa9bcc3c5dc.jpg
666 Satan Tập 4 [Tặng Kèm Bookmark Nhân Vật],Seishi Kishimoto,666 Satan Tập 4 [Tặng Kèm Bookmark Nhân Vật],30000,2000,,https://salt.tikicdn.com/ts/product/fa/83/e5/fb26597d567aa82503f1f8e4396eaebd.jpg
Omoiyari - Nghệ Thuật Đối Nhân Xử Thế Của Người Nhật,Erin Niimi Longhurst,Sách nghệ thuật sống đẹp,94140,2000,,https://salt.tikicdn.com/ts/product/0e/8a/d7/0c508b631d240d69616af13b3419a92b.jpg
