title,author,category,price,publicationYear,description,imageUrl
Kết Thúc Bán Hàng Đòn Quyết Định (Tái Bản),Brian Tracy,Sách Marketing - Bán hàng ,72000,2000,,https://salt.tikicdn.com/ts/product/8b/e4/de/f548dce652676e4b4a907f1ceb311d68.jpg
Viết Đi Đừng Sợ! Từ Tay Không Thành Tay Viết,Linh Phan,Sách Marketing - Bán hàng ,171500,2000,,https://salt.tikicdn.com/ts/product/cf/b0/16/8d8275b11faf028126e88c6b12b73e7b.jpg
Bách Khoa Thư Thực Tế Ảo Tăng Cường - Khủng Long 3D Tập 2,DEVAR,Kiến thức - Bách khoa,123500,2000,,https://salt.tikicdn.com/ts/product/83/0b/42/2922a10510d4505157e081f0fda03cb8.jpg
"Sách - Kinh Địa Tạng Bồ Tát Bổn Nguyện Bìa Da,Bìa Thường",HT.Thích Trí Tịnh,"Sách - Kinh Địa Tạng Bồ Tát Bổn Nguyện Bìa Da,Bìa Thường",32000,2000,,https://salt.tikicdn.com/ts/product/80/5a/e9/df8ff94758da62fe4e3959d22feabc22.png
Hoa Mộng Ảo,Higashino Keigo,Tiểu Thuyết,77400,2000,,https://salt.tikicdn.com/ts/product/22/fa/03/f971284635e4519bcc69f6ed94460296.jpg
Combo 2 cuốn Giáo Trình Hán Ngữ (Sách học Tiếng Trung dành cho người Việt) Giáo Trình Hán Ngữ Tập 1 + Giáo Trình Hán Ngữ Tập 2 (Phiên bản mới - Học bằng App McBooks),,Sách Học Tiếng Hoa,170500,2000,,https://salt.tikicdn.com/ts/product/18/22/67/b75072921579af860c36307d08487b27.jpg
Giá Mà Nỗi Buồn Có Thể Cầm Nắm Trên Tay - Tặng kèm 03 postcard,Rei,Sách nghệ thuật sống đẹp,80100,2000,,https://salt.tikicdn.com/ts/product/3f/1d/e0/066db317d6f362a0b1308fbae200730a.jpg
Quốc Gia Khởi Nghiệp ( Tái Bản 2019 ),Dan Senor,Sách kinh tế học,135850,2000,,https://salt.tikicdn.com/ts/product/e6/a1/a6/6e49e77800161303fbdb9439a3ff2b18.JPG
Sách Tết 2023 - Set Mở ra là thấy Tết (2 phiên bản Bắc Nam) kèm quà tặng cho bé 0-3-6 tuổi,,Truyện tranh thiếu nhi,85000,2000,,https://salt.tikicdn.com/ts/product/2a/0c/b9/bbf8f99d62ac7a83ad0e2a5790147399.jpg
Không Thể Ngừng Suy Nghĩ: Bí Quyết Giải Tỏa Lo Âu Và Khai Phóng Tâm Trí ,Nancy Colier,Sách tư duy - Kỹ năng sống,69001,2000,,https://salt.tikicdn.com/ts/product/1d/18/63/6e49a0bdee80c11653890876049ac1eb.jpg
Ai Che Lưng Cho Bạn (Tái Bản 2017),Keith Ferrazzi,Sách kỹ năng làm việc,68001,2000,,https://salt.tikicdn.com/ts/product/a4/0d/59/bc28f653827780b3967a4904fb6d0a9a.jpg
Chuyện Cổ Tích Dành Cho Người Lớn (Tái Bản 2022),Nguyễn Nhật Ánh,Truyện ngắn - Tản văn - Tạp Văn,25300,2000,,https://salt.tikicdn.com/ts/product/ef/27/00/24e9a84ef9255a2e34ecb4f31478e3fb.jpg
Từ Vựng Tiếng Anh Thực Hành - English Collocations In Use (Tái Bản),.,Sách Học Tiếng Anh,80000,2000,,https://salt.tikicdn.com/ts/product/71/1b/7b/48334959e91a021ac60df6228104b514.jpg
Đất Máu Sicily (Mario Puzo),Mario Puzo,Tác phẩm kinh điển,69500,2000,,https://salt.tikicdn.com/media/catalog/product/d/a/dat mau - bia 1.u335.d20160701.t101955.jpg
Marketing Căn Bản (Tái bản),Don Sexton,Sách Marketing - Bán hàng ,167170,2000,,https://salt.tikicdn.com/ts/product/c3/5c/72/aa9f3ab0519b0b24251e62ede6a7e924.jpg
Tô Màu Phát Triển Trí Não Bộ Cho Bé 1-3 Tuổi - Tập 2,,Tô màu - Luyện chữ  ,12000,2000,,https://salt.tikicdn.com/ts/product/3e/de/a2/10a3bf7787f8eaa9bcc5a295282e7b41.jpg
Sói Già Phố Wall - Phần I (Tái Bản 2020),Jordan Belfort,"Sách tài chính, tiền tệ",115000,2000,,https://salt.tikicdn.com/ts/product/68/b5/6a/78613d52bb6aba040aa89c6c7c57e3d6.jpg
Phân tích tài chính doanh nghiệp Tai bản lần thứ 5 - chỉnh sửa bổ sung năm 2021 (Tái bản 2022),,"Sách tài chính, tiền tệ",99000,2000,,https://salt.tikicdn.com/ts/product/7d/cf/9f/e1695f7362ff3b7326b24f33a368de80.jpg
Combo 2 Cuốn: Thần Số Học + Luật Tâm Thức,Nhiều tác giả,Sách tư duy - Kỹ năng sống,292001,2000,,https://salt.tikicdn.com/ts/product/00/af/1b/bc72e8496b62c264dd47d173f9e1782c.jpg
Very Easy Toeic 1 - Introduction,Anne Taylor,Sách Học Tiếng Anh,150400,2000,,https://salt.tikicdn.com/media/catalog/producttmp/98/d1/2c/443eca95ece30fb05987db48562b2886.jpg
Thám Tử Đã Chết Tập 4,Nigozyu,Light novel,76300,2000,,https://salt.tikicdn.com/ts/product/81/6d/14/512d3abda5f642ff166cff5b5043bee5.jpg
Thiết Kế Lấy Người Dùng Làm Trung Tâm,Don Norman,Sách Marketing - Bán hàng ,127000,2000,,https://salt.tikicdn.com/ts/product/71/ab/43/adb27736060eecbbe31d5dbc3964fb4c.jpg
Đánh Thức Con Người Phi Thường Trong Bạn (Bìa Cứng),Anthony Robbins,Sách tư duy - Kỹ năng sống,137200,2000,,https://salt.tikicdn.com/ts/product/91/da/da/7aa58688edca130f47e0b407b94bc205.jpg
Việt Nam Dọc Miền Du Ký - Tập 2,,Sách Địa Danh - Du Lịch,153300,2000,,https://salt.tikicdn.com/ts/product/ed/8d/00/e67fde6bf045046735b8787dbe72e6f6.jpg
Cô Gái Trong Cabin Số 10,Ruth Ware,Truyện trinh thám,119000,2000,,https://salt.tikicdn.com/ts/product/56/f9/03/866bd3be40d00cf1a8fbf08d719d9d3a.jpg
Vẻ Đẹp Của Yêu Tinh,Đỗ Anh Vũ,Tiểu Thuyết,65600,2000,,https://salt.tikicdn.com/ts/product/c0/c4/46/8a3bf29a23d05bf08ad2a04da30bb44e.jpg
Birdmen Tập 13 [Tặng Kèm Postcard],Yellow Tanabe,Birdmen Tập 13 [Tặng Kèm Postcard],30000,2000,,https://salt.tikicdn.com/ts/product/43/2f/76/7ebdbdfe5e63bb727acfdbb60e947a0d.jpg
Nhật ký Đặng Thùy Trâm,Đặng Thùy Trâm,Truyện ngắn - Tản văn - Tạp Văn,54000,2000,,https://salt.tikicdn.com/ts/product/8f/a0/2c/d4d1a5f0022b485604b5a3f7c47d822d.jpg
Một Mảnh Trăng (Tặng Kèm 1 Obi Và 1 Bookmark),Ha Hyun,Truyện ngắn - Tản văn - Tạp Văn,66800,2000,,https://salt.tikicdn.com/ts/product/12/c3/3a/3a78fc7a57e71a812c463f376028ee75.jpg
Heidegger Và Con Hà Mã Bước Qua Cổng Thiên Đường (Tái Bản 2020),Thomas Cathcart,Truyện Giả tưởng - Huyền Bí - Phiêu Lưu,63000,2000,,https://salt.tikicdn.com/ts/product/ee/53/7c/646755a4cbb4cf24b49bb908d8914368.jpg
Bye Béo - Cách giảm 7kg trong 30 ngày,Phan Bảo Long,Chăm sóc sức khỏe,199000,2000,,https://salt.tikicdn.com/ts/product/9a/ec/66/d97caab91561cc4f4f4a46a7b18dcd78.jpg
Barron's Essential Words For The Ielts (Tái Bản),,Sách Học Tiếng Anh,137200,2000,,https://salt.tikicdn.com/media/catalog/producttmp/d2/7c/c0/131954bec4ea1097c05bf28fdef7a6c5.jpg
"Combo 4 cuốn Chuyện con mèo dạy hải âu bay, Chuyện con mèo con chuột và bạn thân của nó, chuyện con ốc sên, chuyện chú chó tên là trung thành",Luis Sepulveda,Truyện kể cho bé,103240,2000,,https://salt.tikicdn.com/ts/product/8a/fe/39/9679b8b4f348349d1e0049264323bf89.jpg
Những Tù Nhân Của Địa Lí - Khám Phá Sự Vận Hành Của Thế Giới Qua Những Tấm Bản Đồ - Phiên Bản Minh Hoạ Màu Dành Cho Độc Giả Trẻ,Tim Marshall,Kiến thức - Bách khoa,168000,2000,,https://salt.tikicdn.com/ts/product/49/b0/e0/de1621358fb64d08a8f5c08e2a0e1130.jpg
Giáo Trình Chuẩn HSK 5 Bài Học (Tập 1),Khương Lệ Bình,Sách Học Tiếng Hoa,183600,2000,,https://salt.tikicdn.com/ts/product/5f/74/6f/9d36047259f6258f3e997e67848f5f6e.jpg
Của Chuột Và Người,John Steinbeck,Truyện dài,51600,2000,,https://salt.tikicdn.com/ts/product/d0/37/81/e964a484e38e55f48f42a622c4897589.jpg
Sẽ Có Cách Đừng Lo,Tuệ Nghi,Tiểu sử - Hồi ký,49000,2000,,https://salt.tikicdn.com/ts/product/d7/ce/eb/e0a223530a34126725273dbdcc46990f.jpg
Việt Nam Vận Hội,Nguyễn Thế Anh,Lịch Sử Việt Nam,124500,2000,,https://salt.tikicdn.com/ts/product/20/94/4e/f07ce095d0e4442670790e289ecf5ab6.jpg
Combo Cà Phê Cùng Tony và Trên Đường Băng,Tony Buổi Sáng,Sách nghệ thuật sống đẹp,181250,2000,,https://salt.tikicdn.com/ts/product/8e/7a/61/47f4dfb634e076ff7c5418580ea8578c.jpg
Infinite Dendrogram 01- Khởi Điểm Của Những Khả Năng,Kaidou Sakon,Light novel,75000,2000,,https://salt.tikicdn.com/ts/product/2e/be/1b/ae98851a134a70f970dfabdeda2d2f8b.jpg
"Kiếm Tiền Thời Khủng Hoảng - Thoát Khỏi Các Trò Lừa Đảo Khi Thị Trường Chứng Khoán, Bất Động Sản Và Tài Chính Suy Thoái (Tái Bản 2020)",,Bài học kinh doanh,105400,2000,,https://salt.tikicdn.com/ts/product/a6/0f/44/d1ad02681fd85703ab74695c389360de.jpg
Hài Hước Một Chút Thế Giới Sẽ Khác Đi,The Book Worm,Sách tư duy - Kỹ năng sống,46000,2000,,https://salt.tikicdn.com/ts/product/48/e8/3b/c995bdcb3afe1b906e874f6c1d56fc63.jpg
Trái cây đại chiến Zombie - Thế giới khủng long: Tập 1: Chiến binh mạo hiểm,Tiếu Giang Nam,Kiến thức - Bách khoa,52200,2000,,https://salt.tikicdn.com/ts/product/4d/b4/e6/162ae2f2abda83ebb6719ce5463adc6c.jpg
Tạp chí Forbes Việt Nam - Số 111 (Tháng 11.2022) - Giải mã nhà phát triển dự án,nhieu tac gia,Tạp chí Forbes Việt Nam - Số 111 (Tháng 11.2022) - Giải mã nhà phát triển dự án,95000,2000,,https://salt.tikicdn.com/ts/product/03/f0/8d/4208ab03998a520deacdf31810cbf97a.jpg
Cẩm Nang Hướng Dẫn Tẩy Sỏi Gan Mật - Phương Pháp Diệu Kỳ Cho Sức Khỏe Dài Lâu,Andreas Moritz,Cẩm Nang Hướng Dẫn Tẩy Sỏi Gan Mật - Phương Pháp Diệu Kỳ Cho Sức Khỏe Dài Lâu,139300,2000,,https://salt.tikicdn.com/ts/product/33/5b/cf/6783958ea9292dc1858ce46e95dbb6e3.jpg
Ánh Lửa Trong Tro Tàn,Sabaa Tahir,Tiểu Thuyết,79500,2000,,https://salt.tikicdn.com/ts/product/e7/f0/e3/8cf1ba8b1741f600799ecbd11416505e.jpg
"Thần Với Chả Thoại (Những Câu Chuyện ""Mệt Mỏi"" Về Các Vị Thần)",Fanpage Thần với chả Thoại,Lĩnh vực khác,125000,2000,,https://salt.tikicdn.com/ts/product/7b/4d/73/e2af378ba724061abc5eb1d35d3a4a7d.jpg
Nhà thờ Đức Bà Paris (Bìa Cứng),Victor Hugo,Tác phẩm kinh điển,442000,2000,,https://salt.tikicdn.com/ts/product/52/15/90/e2a93faa32d0a5938c292974d1effe48.jpg
Migi & Dali - Tập 4,Nami Sano,Migi & Dali - Tập 4,40000,2000,,https://salt.tikicdn.com/ts/product/51/18/e5/f3fa432792ec220671a4859898de8c41.jpg
Điểm Bùng Phát ( Tái Bản),Malcolm Gladwell,Sách tư duy - Kỹ năng sống,112770,2000,,https://salt.tikicdn.com/ts/product/62/3f/0b/b577cf4cea76a088079b67cfb207e522.jpg
Tớ đã từng sợ hãi,Chandra Ghosh Ippen,Đạo đức - Kỹ năng sống,48001,2000,,https://salt.tikicdn.com/ts/product/95/4d/21/f695dbd3a4bae071c757a543f623ef70.jpg
Hagakure - Luận Đàm Về Cốt Tủy Võ Sĩ Đạo,Yamamoto Tsunetomo,Lĩnh vực khác,121500,2000,,https://salt.tikicdn.com/ts/product/6b/ac/61/371722b321e63caaa28a2c564954a422.jpg
Bỉ Vỏ (Tái Bản 2020),Nguyên Hồng,Tiểu Thuyết,28500,2000,,https://salt.tikicdn.com/ts/product/b9/62/22/411f7fb9c73c359d0d4a449f33ece256.jpg
Dòng Sông Trôi Khuất Địa Đàng,Richard Dawkins,Kiến Thức Bách Khoa,55500,2000,,https://salt.tikicdn.com/ts/product/e5/be/f5/c92586189d61fcbc56b5c2f63a9ddd65.jpg
"Tóm Tắt Kiến Thức Toán Phổ Thông (Bí Quyết Học Nhẹ, Điểm Cao Trong Môn Toán)",Đỗ Minh Triết,Sách tham khảo cấp III,137750,2000,,https://salt.tikicdn.com/ts/product/bc/b7/da/a21be2c762010072e7bb7c6196e27282.jpg
Nuôi Con Không Phải Là Cuộc Chiến 2 (Trọn Bộ 3 Tập),Hachun Lyonnet (Hà Chũn),Sách Làm Cha Mẹ,277800,2000,,https://salt.tikicdn.com/ts/product/0b/22/17/ea58a9430867458cb248e6cc6a7f8aab.jpg
Jeff Bezos Và Kỷ Nguyên Amazon (Tái Bản),Brad Stone,Bài học kinh doanh,77000,2000,,https://salt.tikicdn.com/ts/product/28/6e/a4/e4a00e3c9e0eea66ca13203006b7cc8c.jpg
Combo Tiếng Hàn Tổng Hợp Sơ Cấp 1 Dành Cho Người Việt Nam Bản In Màu - Học Kèm App,nhieu tac gia,Sách Học Tiếng Hàn,224000,2000,,https://salt.tikicdn.com/ts/product/fd/46/80/71467d752a66abfbf37ccc4949862bc5.jpg
Ikigami - Tập 08,Motoro MASE,Ikigami - Tập 08,39100,2000,,https://salt.tikicdn.com/ts/product/70/45/3c/c1f2b287a51113f86e5ecedf037f8107.jpg
"Một Ngày Của Tôi Có 48 Giờ - 12 Thói Quen “Healthy & Balanced"" ",Anh Tuan Le,Sách tư duy - Kỹ năng sống,65100,2000,,https://salt.tikicdn.com/ts/product/af/70/14/70ccca875707c7786d8ddcf294d64233.jpg
Tư Duy Như Một Kẻ Lập Dị,Steven D.Levitt,Sách tư duy - Kỹ năng sống,78001,2000,,https://salt.tikicdn.com/ts/product/f0/00/98/f7bde4d69e87c3f24203492fd558e07d.jpg
Refresh! 20 Ngày Làm Mới Bản Thân,,Sách tư duy - Kỹ năng sống,159200,2000,,https://salt.tikicdn.com/ts/product/cf/95/66/2188ab87ab49707dde9e1bc892e238f6.jpg
Phương Pháp Giáo Dục Sớm Montessori Cho Trẻ Từ,,,,2000,,
,99000,293,2468,2000,,
Anh Em Phi Hành Gia - Tập 33,Chuya Koyama,Anh Em Phi Hành Gia - Tập 33,39100,2000,,https://salt.tikicdn.com/ts/product/59/ab/2f/90021f465b423769ecf2d3bfe8fa7dc1.jpg
"Nghệ Thuật Thị Giác & Những Vấn Đề Cơ Bản : Các Yếu Tố Thị Giác, Nguyên Lý Thị Giác, Tư Duy Thị Giác và Bố Cục Thị Giác",Uyên Huy,Mỹ Thuật - Kiến Trúc,645000,2000,,https://salt.tikicdn.com/ts/product/6c/24/aa/baf087a112448147e42600d378628f2e.jpg
Bản Đồ Tư Duy Trong Thuyết Trình  (Tái bản 2022),Alphabooks,Sách kỹ năng làm việc,55500,2000,,https://salt.tikicdn.com/ts/product/3f/e3/9e/62b6b8ebcd67cd841657c67ad92412b5.jpg
Út Quyên Và Tôi (Tái Bản 2022),Nguyễn Nhật Ánh,Truyện ngắn - Tản văn - Tạp Văn,24500,2000,,https://salt.tikicdn.com/ts/product/79/5c/1c/2b623766121a122a17b9a7311d19bfc8.jpg
Vũ Tịch,Trường An,Lịch Sử Việt Nam,84000,2000,,https://salt.tikicdn.com/media/catalog/product/p/h/photo_2017-08-24_15-21-49.u5505.d20170825.t133740.429953.jpg
Ngọc Sáng Trong Hoa Sen (Tái Bản 2020),Nguyên Phong,Sách nghệ thuật sống đẹp,84400,2000,,https://salt.tikicdn.com/media/catalog/producttmp/b5/ac/4a/938d265efb596ab0d38992893592619f.jpg
Quản Trị Nhân Sự Đúng,Barbara Mitchell,Sách quản trị nhân lực,176300,2000,,https://salt.tikicdn.com/ts/product/fa/24/86/b792a39a52557e4e4b1726dc94b6a995.jpg
Tin Học Ứng Dụng Lập Trình VBA Trong Excel ( Phần Nâng Cao)  Dùng cho Phiên Bản 2021-2019-2016,Phạm Phương Hoa,Tin Học Văn Phòng,123100,2000,,https://salt.tikicdn.com/ts/product/d5/93/c8/4ff201412d8ac2bd0b9f001a2448a462.jpg
Hoa Sen Trên Tuyết (Tái Bản 2020),Nguyên Phong,Sách Địa Danh - Du Lịch,64600,2000,,https://salt.tikicdn.com/ts/product/03/03/04/fbbd5814b409160f58ed5e5da62a8586.jpg
Combo Một Đời Quản Trị và Một Đời Thương Thuyết ,Phan Văn Trường,"Sách quản trị, lãnh đạo",291450,2000,,https://salt.tikicdn.com/ts/product/d0/ee/b7/5b322e8fa769acdc35bc176e71c13cc5.jpg
Tâm Lý Học Thành Công (Tái Bản),Carol S. Dweck,Sách tư duy - Kỹ năng sống,129350,2000,,https://salt.tikicdn.com/ts/product/41/c8/23/86289a16b242a20ca172c0d9b9c7b978.jpg
Tản mạn kiến trúc Nam Bộ - Một biên khảo về kiến trúc dân dụng miền Nam (Từ cuối thế kỷ 19 đến cuối thế kỷ 20),Nhóm tác giả Tản Mạn Kiến Trúc,Mỹ Thuật - Kiến Trúc,167000,2000,,https://salt.tikicdn.com/ts/product/ee/6d/24/219d791d1ff385ca788fc33c349da98e.jpg
Thương tiến tửu - Tập 1 (Tiểu thuyết đam mỹ) -Tặng 1 bookmark,Đường Tửu Khanh,Truyện đam mỹ,96900,2000,,https://salt.tikicdn.com/ts/product/aa/18/25/dd00442aed21d9215931be165aaff625.jpg
Dữ Liệu Bạch Kim (Văn Học Trinh Thám),Higashino Keigo,Truyện trinh thám,112000,2000,,https://salt.tikicdn.com/ts/product/0e/b7/c4/c9b9969e212eb2ebecce14cc37d5803c.jpg
Julie Hay Nàng Héloïse Mới,Jean-Jacques Rousseau,Tiểu Thuyết,149500,2000,,https://salt.tikicdn.com/ts/product/19/57/4c/0b1a9b7a3c79e366c622e6d19a4128a8.jpg
Migi & Dali - Tập 2,Nami Sano,Migi & Dali - Tập 2,37100,2000,,https://salt.tikicdn.com/ts/product/78/0f/70/77a75a38a0a58eecaa388901b55c4b54.jpg
Chú Thuật Hồi Chiến -  Tập 5,Gege Akutami,Chú Thuật Hồi Chiến -  Tập 5,26001,2000,,https://salt.tikicdn.com/ts/product/2a/6d/e2/ea1dd6676027a23c422db71e4f64c181.jpg
Thám Tử Kindaichi (Series Kỷ Niệm 20 Năm) - Boxset 5 Tập,Seimaru Amagi,Thám Tử Kindaichi (Series Kỷ Niệm 20 Năm) - Boxset 5 Tập,143001,2000,,https://salt.tikicdn.com/ts/product/a2/fc/16/3003c2aeefa02cf23317aed7ef14c55e.jpg
Bé Gái Khéo Tay Buộc Dây Giày,,Văn học thiếu nhi,61200,2000,,https://salt.tikicdn.com/ts/product/ed/99/71/fd903cebfb5b879ff4c061eae9383fe0.jpg
Tâm Lý Dân Tộc An Nam,Paul Giran,Lịch Sử Việt Nam,88570,2000,,https://salt.tikicdn.com/ts/product/3f/24/b6/7035b4ff1814d920912569b3a4399546.jpg
Dạy Con Theo Cá Tính Của Con,Aki Wakamatsu,Sách Làm Cha Mẹ,50400,2000,,https://salt.tikicdn.com/ts/product/f5/1e/66/423b2b9d74b2a0ec5310830a11444cae.jpg
Thần Số Học: Sức Mạnh Của Những Con Số,Ruth A. Drayer,Lĩnh vực khác,97300,2000,,https://salt.tikicdn.com/ts/product/fd/07/34/58382fd1cdf348bacb821b33acf14c3a.jpg
Sách - Tin Vào Chính Mình - First News,,Sách tư duy - Kỹ năng sống,64600,2000,,https://salt.tikicdn.com/ts/product/70/94/34/0f2c4ee946c85cf54d855017c0c2cc5f.jpg
Dốc Hết Trái Tim - Cách Starbucks Xây Dựng Công Ty Bằng Từng Tách Cà Phê (Tái Bản 2018),Howard Schultz,Sách kỹ năng làm việc,105500,2000,,https://salt.tikicdn.com/ts/product/2a/a5/0c/2e7c4c99c9faceda9e926727bb5cc92a.jpg
Sách tiếng anh: Destination C1+C2,,Sách Học Tiếng Anh,84000,2000,,https://salt.tikicdn.com/ts/product/45/f1/e8/1ca79bdbf11f3d7991a53676e4b71a53.jpg
7 Chiến Lược Thịnh Vượng Và Hạnh Phúc (Tái Bản),Jim Rohn,Sách kỹ năng làm việc,72000,2000,,https://salt.tikicdn.com/ts/product/a9/68/94/0b0fdee95110537eee0b1f572372448e.jpg
Tâm Lí Học Tích Cực - Khoa Học Về Phương Thức Sống An Lạc,Acacia C. Parks,Sách giáo dục,247900,2000,,https://salt.tikicdn.com/ts/product/62/c3/6c/cd3d98b2f86bb52f31cd3adabeb80cbe.jpg
Fullmetal Alchemist - Cang Giả Kim Thuật Sư - Fullmetal Edition - Tập 16,Hiromu Arakawa,Fullmetal Alchemist - Cang Giả Kim Thuật Sư - Fullmetal Edition - Tập 16,67000,2000,,https://salt.tikicdn.com/ts/product/70/dd/1f/260d36b977019b355f3beb48295676e3.jpg
Trong Chớp Mắt (Tái Bản 2018),Malcolm Gladwell,Sách tư duy - Kỹ năng sống,88400,2000,,https://salt.tikicdn.com/ts/product/79/f4/2f/a63579d8fa58b024530943c397e29aba.jpg
Siêu Tập Trung (Tái Bản),Chris Bailey,Sách kỹ năng làm việc,93800,2000,,https://salt.tikicdn.com/ts/product/9f/ab/87/b96ea6b2ce9e9d64975d86ea58e2aa7b.png
Combo Giáo Trình Chuẩn HSK 2 - Bài Học (Kèm 1 MP3) và Giáo Trình HSK 2 - Sách Bài Tập (Kèm MP3) ( Tặng Kèm Viết ),Khương Lệ Bình,Sách Học Tiếng Hoa,310700,2000,,https://salt.tikicdn.com/ts/product/59/2e/b5/e647ce6d0e12230fea704fab8400eab1.jpg
Bài Thơ Của Một Người Yêu Nước Mình,Trần Vàng Sao,Thơ,78000,2000,,https://salt.tikicdn.com/ts/product/c6/a7/84/1906b28a70069a36d8d6e3d0b01d3444.jpg
Đánh Bại Thị Trường Forex - Tư Duy Khác Biệt Và Kỹ Thuật Giao Dịch của Chuyên Gia Quản Lý Quỹ Triệu Đô,,"Sách tài chính, tiền tệ",347000,2000,,https://salt.tikicdn.com/ts/product/85/14/8a/b4bf9f946908febaec0f8724a28852e7.jpg
Vì Sao Phật Giáo Giàu Chân Lý,Robert Wright,Vì Sao Phật Giáo Giàu Chân Lý,174200,2000,,https://salt.tikicdn.com/ts/product/71/d3/d4/7a8603a7b8edc8e7907725bab0db6ab6.jpg
Nghiệp Tình Yêu,Geshe Michael Roach,Sách tư duy - Kỹ năng sống,129600,2000,,https://salt.tikicdn.com/ts/product/b2/d0/6d/55298e1d5d08c922415016015888bbc5.jpg
Dragon Quest - Dấu Ấn Roto (Dragon Quest Saga Emblem Of Roto) Perfect Edition - Tập 9,Kamui Fujiwara,Dragon Quest - Dấu Ấn Roto (Dragon Quest Saga Emblem Of Roto) Perfect Edition - Tập 9,74100,2000,,https://salt.tikicdn.com/ts/product/5e/61/61/b9eb1aea36572c9a044de01cb31b1226.jpg
Khác Biệt Hay Là Chết (Tái Bản),Jack Trout,Sách tư duy - Kỹ năng sống,84400,2000,,https://salt.tikicdn.com/media/catalog/producttmp/fd/44/5b/7febda78b893cb989215401956ca6bd6.jpg
Đắc Nhân Tâm - Bìa Mềm (Tái Bản 2019),Dale Carnegie,Sách tư duy - Kỹ năng sống,62000,2000,,https://salt.tikicdn.com/ts/product/49/07/d7/7d0b1c558a0ae78db544e21b23b8ecc5.png
Bàn Tay Ánh Sáng,Barbara Ann Brennan,Kiến Thức Bách Khoa,188300,2000,,https://salt.tikicdn.com/ts/product/95/27/2f/57db3e1a04439252fc8e4a45ab5dd4d4.jpg
Combo Người Thông Minh Giải Quyết Vấn Đề Như Thế Nào + Người Giỏi Không Phải Là Người Làm Tất Cả,,Sách kỹ năng làm việc,104400,2000,,https://salt.tikicdn.com/ts/product/9b/83/8c/9d23ea52e90d48ca49d3b76da7e32649.jpg
"Hoảng Loạn, Hỗn Loạn Và Cuồng Loạn - Gần 400 Năm Lịch Sử Các Cuộc Khủng Hoảng Tài Chính",Charles P. Kindleberger,Bài học kinh doanh,114200,2000,,https://salt.tikicdn.com/ts/product/fc/d6/62/f78ad0f467a20f3a400451afd01fb3e3.jpg
Tư Duy Lại Lợi Thế Cạnh Tranh - 6 Quy Tắc Mới Cho Thời Đại Số,Ram Charan,"Sách quản trị, lãnh đạo",89100,2000,,https://salt.tikicdn.com/ts/product/1d/6f/65/d9daa43fda26e944a52fcd1e58ce3676.jpg
Thầy Cô Giáo Hạnh Phúc Sẽ Thay Đổi Thế Giới - Tập 2 - Đi Như Một Dòng Sông (Tái Bản),Thích Nhất Hạnh,Thầy Cô Giáo Hạnh Phúc Sẽ Thay Đổi Thế Giới - Tập 2 - Đi Như Một Dòng Sông (Tái Bản),69300,2000,,https://salt.tikicdn.com/ts/product/e1/38/09/d812da8737f05c1f97bf53bc908fe5db.jpg
Mô Hình Biểu Đồ - Phương pháp Hiệu quả để Tìm kiếm Lợi nhuận,,"Sách tài chính, tiền tệ",368000,2000,,https://salt.tikicdn.com/ts/product/62/58/4b/13679d678d91708e7341054ccba7fa42.jpg
Trò Chơi Vô Cực - Chiến Lược Dẫn Đầu Trong Thời Đại Khách Hàng Thông Minh,Simon Sinek,Sách kỹ năng làm việc,104000,2000,,https://salt.tikicdn.com/ts/product/0a/3a/2f/d94b9f8ad976bd1ea65d864b2c1f206e.jpg
Yuri Espoir (Tập 3),Naoi Mai,Yuri Espoir (Tập 3),63100,2000,,https://salt.tikicdn.com/ts/product/89/74/20/858a00cfd4848a8a51ab4cd8e3fa1e6d.png
Tam Thể 3 - Tử Thần Sống Mãi,Lưu Từ Hân,Truyện Giả tưởng - Huyền Bí - Phiêu Lưu,159500,2000,,https://salt.tikicdn.com/ts/product/fc/ea/63/f7df6a768f2ced1986321c0e843bd06d.jpg
"Trời Sinh Vụng Về, Hãy Bù Đắp Bằng Sự Kiên Trì",,Sách tư duy - Kỹ năng sống,83001,2000,,https://salt.tikicdn.com/ts/product/e7/3a/33/d90504644a26715758f68aa20eebbde5.jpg
Sói Đầu Đàn Và Cún Nhỏ - Tập 2,Ma Vĩ,Sói Đầu Đàn Và Cún Nhỏ - Tập 2,101000,2000,,https://salt.tikicdn.com/ts/product/b0/f8/42/52ddead08d074af75ba84245ed20103d.png
TỬ HUYỆT CẢM XÚC,Roy Garn,Sách tư duy - Kỹ năng sống,119200,2000,,https://salt.tikicdn.com/ts/product/77/2f/bb/5ceb7034affe89645e567c0a6c2fd17a.jpg
Tôi Là Bêtô,Nguyễn Nhật Ánh,Truyện dài,68000,2000,,https://salt.tikicdn.com/media/catalog/producttmp/b2/67/c5/c21876e07e131f287ac1adb38614d66b.jpg
D. Trump - Nghệ Thuật Đàm Phán (Tái bản 2020),Donald J.Trump & Tony Schwartz,"Sách quản trị, lãnh đạo",77800,2000,,https://salt.tikicdn.com/ts/product/f4/99/63/ab805c6b5149f6fd647d7dfdd5157626.jpg
"Gửi Em, Người Bất Tử - Tập 8 (Tái Bản 2022)",Yoshitoki Oima,"Gửi Em, Người Bất Tử - Tập 8 (Tái Bản 2022)",26000,2000,,https://salt.tikicdn.com/ts/product/02/fb/d7/de3ec70355ba6c0e6b10204f8978e1c1.jpg
"Điềm Tĩnh Trong Bận Rộn - Ít Hơn, Hiệu Quả Hơn",,Sách kỹ năng làm việc,60000,2000,,https://salt.tikicdn.com/ts/product/ad/f0/bc/617ca4b190abfb326bdb731c0352e273.JPG
Thiên Quan Tứ Phúc - Tập 3,Mặc Hương Đồng Khứu,Truyện ngôn tình,91200,2000,,https://salt.tikicdn.com/ts/product/e5/47/bb/b2a9842c3a23f379162aebaaddac8e61.jpg
Black Jack 10 (Bìa Mềm),Osamu Tezuka,Black Jack 10 (Bìa Mềm),26000,2000,,https://salt.tikicdn.com/ts/product/95/13/a3/ba5a35d5626590670232fda0a96acf2f.jpeg
The Art and Science of Technical Analysis – Phân tích kỹ thuật: Sự kết hợp giữa KHOA HỌC và NGHỆ THUẬT trong đầu tư chứng khoán,,"Sách tài chính, tiền tệ",569000,2000,,https://salt.tikicdn.com/ts/product/42/ba/7e/44f8ef20af1daf36ae7adb05dc7322d7.jpg
Ehon - Cây Sồi (Tái Bản 2020),Akiko Kameoka,Truyện tranh Ehon,34300,2000,,https://salt.tikicdn.com/ts/product/9d/5a/6c/2584d783bb945f7a806b072203a4bcc1.jpg
Chiêm Tinh Học For Dummies,Rae Orion,Sách Chiêm Tinh - Horoscope,174300,2000,,https://salt.tikicdn.com/ts/product/5e/46/86/8bfc49675dfdbd67f0cb8376138065e9.jpg
Thần Số Học - Làm Chủ Cuộc Đời,Michelle Buchanan,Thần Số Học - Làm Chủ Cuộc Đời,109000,2000,,https://salt.tikicdn.com/ts/product/47/73/06/280b2e27cf3933a799320524fcbca4b4.jpg
Trở Về Từ Xứ Tuyết (Tái Bản),Nguyên Phong,Trở Về Từ Xứ Tuyết (Tái Bản),60700,2000,,https://salt.tikicdn.com/media/catalog/producttmp/1a/e8/80/25f91b83dd17f63152d01f08586d8fa8.jpg
Nhật Ký Tarot,,Sách Chiêm Tinh - Horoscope,143000,2000,,https://salt.tikicdn.com/ts/product/3d/1c/25/531bcebfc63d73c61a85759db8c76ec1.jpg
Trí Tuệ Tài Chính Dành Cho Nhà Quản Lý Nhân Sự,.,"Sách quản trị, lãnh đạo",121900,2000,,https://salt.tikicdn.com/ts/product/01/f2/7b/5ab5c4fe408d77a3f8a555cc89e9a6c6.jpg
Nhịn Khô,Sergey Filonov,Kiến thức - Bách khoa,97300,2000,,https://salt.tikicdn.com/ts/product/d0/7e/4c/b985d91f5ee7ed90462ef6c2031205d6.jpg
Animorphs - Người Hóa Thú (Tập 5) : Thú Săn Mồi,Katherine Applegate,Truyện Giả tưởng - Huyền Bí - Phiêu Lưu,63000,2000,,https://salt.tikicdn.com/ts/product/b7/be/8b/205e077569e86a29755515be1e9b27b3.jpg
