title,author,category,price,publicationYear,description,imageUrl
Cây Cam Ngọt Của Tôi,José Mauro de Vasconcelos,Tiểu Thuyết,64800,2000,,https://salt.tikicdn.com/ts/product/5e/18/24/2a6154ba08df6ce6161c13f4303fa19e.jpg
Hành Tinh Của Một Kẻ Nghĩ Nhiều,Nguyễn Đoàn Minh Thư,Sách tư duy - Kỹ năng sống,59900,2000,,https://salt.tikicdn.com/ts/product/d7/99/24/17bff8d26027846b2d7478ad4ba83fea.jpg
Những Tù Nhân Của Địa Lý,Tim Marshall,Lĩnh vực khác,126000,2000,,https://salt.tikicdn.com/ts/product/8d/96/9e/c0c1f23db756d50b1944dff9c3988753.jpg
Nhà Giả Kim (Tái Bản 2020),Paulo Coelho,Tác phẩm kinh điển,47400,2000,,https://salt.tikicdn.com/ts/product/45/3b/fc/aa81d0a534b45706ae1eee1e344e80d9.jpg
Điều Kỳ Diệu Của Tiệm Tạp Hóa NAMIYA (Tái Bản),Higashino Keigo,Truyện ngắn - Tản văn - Tạp Văn,63000,2000,,https://salt.tikicdn.com/ts/product/dd/49/7f/ab94b8b2e35c49fc38b063fae4e8266a.jpg
Thao Túng Tâm Lý,Shannon Thomas,Sách tư duy - Kỹ năng sống,103000,2000,,https://salt.tikicdn.com/ts/product/90/49/97/ec88ab408c1997378344486c94dbac40.jpg
Thư Viện Nửa Đêm,Matt Haig,Truyện Giả tưởng - Huyền Bí - Phiêu Lưu,90000,2000,,https://salt.tikicdn.com/ts/product/8e/32/3d/e4487c4c7e335bbda4f06dd54d8e35b8.jpg
Những Tù Nhân Của Địa Lý,Tim Marshall,Lĩnh vực khác,126000,2000,,https://salt.tikicdn.com/ts/product/8d/96/9e/c0c1f23db756d50b1944dff9c3988753.jpg
Không Phải Sói Nhưng Cũng Đừng Là Cừu ,Lê Bảo Ngọc,Sách tư duy - Kỹ năng sống,96000,2000,,https://salt.tikicdn.com/ts/product/5b/96/23/348b84ca8e0d0b49bf9c8d9595336e69.jpg
Càng Bình Tĩnh Càng Hạnh Phúc,Vãn Tình,Sách tư duy - Kỹ năng sống,85180,2000,,https://salt.tikicdn.com/ts/product/ca/b9/76/3496cc7fd438e19e0a5732cba25e0aee.png
Yêu Những Điều Không Hoàn Hảo,Hae Min,Truyện ngắn - Tản văn - Tạp Văn,83400,2000,,https://salt.tikicdn.com/ts/product/54/55/d6/4ceb6ba3bd81614df8ff4c1411b11f59.jpg
Quyền Lực Của Địa Lý - The Power Of Geography,Tim Marshall,Sách kinh tế học,221000,2000,,https://salt.tikicdn.com/ts/product/6c/87/e7/db72a8050a15d86d8102cd21ab1d8b11.jpg
Chiến Binh Cầu Vồng (Tái Bản 2020),Andrea Hirata,Tiểu Thuyết,65400,2000,,https://salt.tikicdn.com/ts/product/a1/ef/4f/0b39e40dca3827604c8bc4e867cc9423.jpg
"Thiên Tài Bên Trái, Kẻ Điên Bên Phải (Tái Bản)",Cao Minh,Truyện ngắn - Tản văn - Tạp Văn,115001,2000,,https://salt.tikicdn.com/ts/product/38/bb/4b/5f03392a2fb98bc19b63de688b2ad218.jpg
How Psychology Works - Hiểu Hết Về Tâm Lý Học,Jo Hemmings,Sách tư duy - Kỹ năng sống,180000,2000,,https://salt.tikicdn.com/ts/product/2b/84/ff/cb34637573525a998596b58d6939411e.jpg
Một Thoáng Ta Rực Rỡ Ở Nhân Gian,,Tiểu Thuyết,81000,2000,,https://salt.tikicdn.com/ts/product/2f/b5/4e/a8208e9019c8510e8a8eebe06f50299c.jpg
Đại Dương Đen - Những Câu Chuyện Từ Thế Giới Của Trầm Cảm,Đặng Hoàng Giang,Truyện ngắn - Tản văn - Tạp Văn,144000,2000,,https://salt.tikicdn.com/ts/product/f7/fb/9a/e8b9a94478dc887c4b84b6b6439f6335.jpg
Cú Săn Đêm,Samuel Bjork,Tiểu Thuyết,113900,2000,,https://salt.tikicdn.com/ts/product/45/6c/b1/1d809c7be82ee19ca6b7ddcb18a494bc.jpg
Vị Thần Của Những Quyết Định,Universe,Sách Chiêm Tinh - Horoscope,55100,2000,,https://salt.tikicdn.com/ts/product/0c/49/5f/751b9c711c12def9beb2a3bbc3290d77.jpg
Hoàng Tử Bé (Tái Bản 2019),Antoine De Saint-Exupéry,Truyện kể cho bé,45000,2000,,https://salt.tikicdn.com/ts/product/5c/e7/68/26838e18d7f96d562d828980520019d2.jpg
Bước Chậm Lại Giữa Thế Gian Vội Vã (Tái Bản),Hae Min,Truyện ngắn - Tản văn - Tạp Văn,51000,2000,,https://salt.tikicdn.com/ts/product/7a/18/8e/2f70de3ea7eec9c34f55e402254e27ed.jpg
Nhà Giả Kim (Tái Bản 2020),Paulo Coelho,Tác phẩm kinh điển,47400,2000,,https://salt.tikicdn.com/ts/product/45/3b/fc/aa81d0a534b45706ae1eee1e344e80d9.jpg
Totto - Chan Bên Cửa Sổ (Tái Bản),Kuroyanagi Tetsuko,Truyện dài,58800,2000,,https://salt.tikicdn.com/ts/product/24/39/01/1718d16b33315c03026cee717adad4b3.jpg
Những Người Khốn Khổ (Boxet 2 Tập),Victor Hugo,Tác phẩm kinh điển,399000,2000,,https://salt.tikicdn.com/ts/product/16/63/e2/b9e75fdf59ba03521829dfe7e2f2034b.jpg
Trăm Năm Cô Đơn,Gabriel Garcia Marquez,Truyện ngắn - Tản văn - Tạp Văn,101400,2000,,https://salt.tikicdn.com/ts/product/37/3b/5d/5efd681d48d5a81e3e6675121e69d38d.jpg
Dịch Hạch (Nobel Văn Chương 1957),Albert Camus,Tác phẩm kinh điển,77400,2000,,https://salt.tikicdn.com/ts/product/36/48/39/2ef073f6a40a268deb12ecc35a6b1145.jpg
Luật Tâm Thức - Giải Mã Ma Trận Vũ Trụ,Ngô Sa Thạch,Lĩnh vực khác,223001,2000,,https://salt.tikicdn.com/ts/product/46/4d/81/dadc621baaa9d45b52a444616d8e3cb8.jpg
Dám Bị Ghét,Koga Fumitake,Tiểu Thuyết,57600,2000,,https://salt.tikicdn.com/ts/product/74/11/ff/6304c47fec56e6f0b2110be65af0c7c2.jpg
Chú Bé Mang Pyjama Sọc (Tái Bản 2018),John Boyne,Truyện kể cho bé,40800,2000,,https://salt.tikicdn.com/ts/product/19/4f/27/99b31589a12ac561e769081c4eb32d1f.jpg
Rừng Nauy (Tái Bản),Haruki Murakami,Tiểu Thuyết,90000,2000,,https://salt.tikicdn.com/ts/product/c9/e4/18/a9cfc425fa590c453f20307229804bb3.jpg
Đại Dương Đen - Những Câu Chuyện Từ Thế Giới Của Trầm Cảm,Đặng Hoàng Giang,Truyện ngắn - Tản văn - Tạp Văn,144000,2000,,https://salt.tikicdn.com/ts/product/f7/fb/9a/e8b9a94478dc887c4b84b6b6439f6335.jpg
Sự Im Lặng Của Bầy Cừu (Tái Bản),Thomas Harris,Truyện dài,69000,2000,,https://salt.tikicdn.com/ts/product/cd/2a/5b/926ca6c7b295c6e7cea39390efe08968.jpg
Tâm Lý Học Về Tiền,Morgan Housel,"Sách tài chính, tiền tệ",133000,2000,,https://salt.tikicdn.com/ts/product/83/23/b7/14a42ae4f66c9b8b298aaef4b9671442.jpg
Bố Con Cá Gai (Tái Bản 2019),Cho Chang - In,Tiểu Thuyết,57600,2000,,https://salt.tikicdn.com/ts/product/85/b4/a3/dc8b8311f434cc946563963bc8e30071.jpg
Xứ Cát,Frank Herbert,Truyện Giả tưởng - Huyền Bí - Phiêu Lưu,149400,2000,,https://salt.tikicdn.com/ts/product/b4/f0/81/5d5e4a26cb029fdecd04e0c30cbef17a.jpg
Sự Im Lặng Của Bầy Cừu (Tái Bản),Thomas Harris,Truyện dài,69000,2000,,https://salt.tikicdn.com/ts/product/cd/2a/5b/926ca6c7b295c6e7cea39390efe08968.jpg
Tuổi Trẻ Đáng Giá Bao Nhiêu (Tái Bản),Rosie Nguyễn,Sách tư duy - Kỹ năng sống,54000,2000,,https://salt.tikicdn.com/ts/product/56/ce/23/64b2eaa5b859d8ba1412f1b350c3e128.jpg
"Nóng Giận Là Bản Năng , Tĩnh Lặng Là Bản Lĩnh",Tống Mặc,Sách tư duy - Kỹ năng sống,57001,2000,,https://salt.tikicdn.com/ts/product/70/9a/98/e6d54019a2079b9565114bce93b245b7.jpg
Hiệu Sách Nhỏ Ở Paris,Nina George,Tiểu Thuyết,89400,2000,,https://salt.tikicdn.com/ts/product/7c/0d/6c/8fcbd6abc1ac716d07b3593f9b97f53b.jpg
Tiếng Núi,Kawabata Yasunari,Tác phẩm kinh điển,132000,2000,,https://salt.tikicdn.com/ts/product/06/b0/b9/7ab33a63c472dddb0310a528119118b9.jpg
Điều Kỳ Diệu Của Tiệm Tạp Hóa NAMIYA (Tái Bản),Higashino Keigo,Truyện ngắn - Tản văn - Tạp Văn,63000,2000,,https://salt.tikicdn.com/ts/product/dd/49/7f/ab94b8b2e35c49fc38b063fae4e8266a.jpg
Bắt Trẻ Đồng Xanh (Tái Bản 2020),Jerome David Salinger,Tiểu Thuyết,52800,2000,,https://salt.tikicdn.com/ts/product/65/74/fb/1e6ca7a2fa28d83667a8e50144e43d0d.jpg
1111 - Nhật Ký Sáu Vạn Dặm Trên Yên Xe Cà Tàng,Trần Đặng Đăng Khoa,Du ký,262000,2000,,https://salt.tikicdn.com/ts/product/16/99/f6/b1b3d72f9802de5ae8ae20d641fd1e63.jpg
Tâm Lý Học - Phác Họa Chân Dung Kẻ Phạm Tội,Diệp Hồng Vũ,Sách tư duy - Kỹ năng sống,93001,2000,,https://salt.tikicdn.com/ts/product/cb/79/53/7cf60ac4e52cb3f61aa1b4986a0efee6.jpg
Phía Sau Nghi Can X (Tái Bản 2019),Higashino Keigo,Truyện trinh thám,65400,2000,,https://salt.tikicdn.com/ts/product/23/56/86/a538698ead7dc2f693d1e9778417317d.jpg
Nàng Tóc Đỏ (Nobel Văn Chương 2006),Yu Sato,Tác phẩm kinh điển,66000,2000,,https://salt.tikicdn.com/ts/product/3d/3e/d8/bdc5a3edcd4ecd6bb91895ffb67cbe11.jpg
Đàn Ông Sao Hỏa Đàn Bà Sao Kim,John Gray,Sách tư duy - Kỹ năng sống,135300,2000,,https://salt.tikicdn.com/ts/product/0a/f6/38/bc10734989977da424642a1c4750eee2.jpg
Kiêu Hãnh Và Định Kiến (Tái Bản),Jane Austen,Tiểu Thuyết,86500,2000,,https://salt.tikicdn.com/ts/product/13/1a/c5/8de00e3c753d0d571b793caeab329d8d.jpg
Ikigai - Bí Mật Sống Trường Thọ Và Hạnh Phúc Của Người Nhật,Ken Mogi,Sách tư duy - Kỹ năng sống,54000,2000,,https://salt.tikicdn.com/ts/product/0c/ae/23/74a7396a4c1bcf48ed016b92ab349b5a.jpg
Nói Một Cách Đơn Giản,Rhee Dongwoo,Sách tư duy - Kỹ năng sống,98000,2000,,https://salt.tikicdn.com/ts/product/f6/90/1a/7798d89cd8c6808df55571c8af40a286.jpg
Một Họa Sĩ Phù Thế,Kazuo Ishiguro,Tiểu Thuyết,101400,2000,,https://salt.tikicdn.com/ts/product/1d/84/65/0914ab54b67cfc02cbe8e36e21ae1ff0.jpg
Bạch Dạ Hành (Tái Bản),Higashino Keigo,Truyện trinh thám,125400,2000,,https://salt.tikicdn.com/ts/product/80/67/af/753a66ef25086f469826f3ee4716f751.jpg
"Nói Chuyện Là Bản Năng, Giữ Miệng Là Tu Dưỡng, Im Lặng Là Trí Tuệ",Trương Tiếu Hằng,Sách nghệ thuật sống đẹp,111000,2000,,https://salt.tikicdn.com/ts/product/53/ec/b6/e67dfef8643496ef9abe6e5430b1a630.jpg
Không Ai Có Thể Làm Bạn Tổn Thương Trừ Khi Bạn Cho Phép (Tặng Kèm 1 Bộ Bookmark Gồm 4 Cái),Yoo Eun Jung,Sách tư duy - Kỹ năng sống,72780,2000,,https://salt.tikicdn.com/ts/product/48/cf/b6/591dc6b51337aca15183552706b57087.jpg
Sáu Người Đi Khắp Thế Gian (Tập 2) ( Tái Bản 2019 ),James Albert Michener,Du ký,127500,2000,,https://salt.tikicdn.com/ts/product/5c/47/0d/3f1a1c7c6f6ab339b1acd2892ee7282e.jpg
Combo 2 Cuốn: Muôn Kiếp Nhân Sinh + Muôn Kiếp Nhân Sinh 2 (Bìa Mềm),Nguyên Phong,Combo 2 Cuốn: Muôn Kiếp Nhân Sinh + Muôn Kiếp Nhân Sinh 2 (Bìa Mềm),248500,2000,,https://salt.tikicdn.com/media/catalog/producttmp/05/e6/c8/f77f8c96a0c0389027846193e9b62ae5.jpg
Hoa Vẫn Nở Mỗi Ngày,,Tiểu Thuyết,140400,2000,,https://salt.tikicdn.com/ts/product/da/f6/2a/963d63c3dca69a9e40094b7765d4a70c.jpg
Tâm Lý Học Hành Vi (Tặng Kèm 1 Bookmark ),Khương Nguy,Sách tư duy - Kỹ năng sống,63001,2000,,https://salt.tikicdn.com/ts/product/cd/72/24/a9f929f98397d1be047e47602989a5e0.jpg
Điềm Tĩnh Và Nóng Giận,Tạ Quốc Kế,Sách tư duy - Kỹ năng sống,63320,2000,,https://salt.tikicdn.com/ts/product/b4/51/cf/467cc6c113c3847a01516006180c20b2.jpg
Quyền Lực Của Địa Lý - The Power Of Geography,Tim Marshall,Sách kinh tế học,221000,2000,,https://salt.tikicdn.com/ts/product/6c/87/e7/db72a8050a15d86d8102cd21ab1d8b11.jpg
Cân Bằng Cảm Xúc Cả Lúc Bão Giông (Tặng Kèm Bookmark)(Tái Bản),Richard Nicholls,Sách tư duy - Kỹ năng sống,76000,2000,,https://salt.tikicdn.com/ts/product/31/36/bb/3287d77a87926609cab4b41077c033ba.jpg
How Money Works - Hiểu Hết Về Tiền,Dịch giả Bùi Thị Quỳnh Chi,Bài học kinh doanh,180000,2000,,https://salt.tikicdn.com/ts/product/d9/00/9e/9ba4a6dbd6700f9c6abd30f1a65b93c4.jpg
Rèn Luyện Tư Duy Phản Biện,Albert Rutherford,Sách tư duy - Kỹ năng sống,54450,2000,,https://salt.tikicdn.com/ts/product/22/cb/a9/524a27dcd45e8a13ae6eecb3dfacba7c.jpg
Một chỗ trong đời,Annie Ernaux,Tác phẩm kinh điển,51700,2000,,https://salt.tikicdn.com/ts/product/17/ae/b5/0331341f5afd84a1845acd591572d710.jpg
Tàn Ngày Để Lại (Bìa Cứng),Kazuo Ishiguro,Tiểu Thuyết,101400,2000,,https://salt.tikicdn.com/ts/product/bc/82/ac/a6bf1a9e771d2741fbe89de5c121bad6.jpg
Chúa Ruồi - Tiểu Thuyết (Nobel Văn Chương 1983)(Tái Bản 2020),William Golding,Tác phẩm kinh điển,52800,2000,,https://salt.tikicdn.com/ts/product/5f/97/52/a53eb98af3927cc5b5aeb08efa58d483.jpg
Cuốn Sách Hoàn Hảo Về Ngôn Ngữ Cơ Thể - Body Language (Tái Bản),Allan & Barbara Pease,Sách tư duy - Kỹ năng sống,159000,2000,,https://salt.tikicdn.com/ts/product/6f/e9/0c/3008cc78076b1ac7240c55bc014580d7.jpg
GIẬN (TBL22),Thích Nhất Hạnh,GIẬN (TBL22),116000,2000,,https://salt.tikicdn.com/ts/product/56/4a/55/ded53bb350d07e82bf01a2b819a0e100.jpg
Tàn Ngày Để Lại (Bìa Cứng),Kazuo Ishiguro,Tiểu Thuyết,101400,2000,,https://salt.tikicdn.com/ts/product/bc/82/ac/a6bf1a9e771d2741fbe89de5c121bad6.jpg
Thạch Sùng Trên Gác Mái,Trịnh Lịch Nhi,Truyện ngắn - Tản văn - Tạp Văn,50150,2000,,https://salt.tikicdn.com/media/catalog/product/t/h/thach-sung-con-tren-gac-mai-01.u53.d20170206.t174801.428508.jpg
Chia Rẽ - Tại Sao Chúng Ta Đang Sống Trong Thời Đại Của Những Bức Tường,Tim Marshall,Truyện ngắn - Tản văn - Tạp Văn,120000,2000,,https://salt.tikicdn.com/ts/product/15/ce/8e/0d9f11fc37b0de189ba66f4f07359108.jpg
Kafka bên bờ biển (Tái Bản 2020),Haruki Murakami,Tiểu Thuyết,94800,2000,,https://salt.tikicdn.com/ts/product/63/99/70/ec162960adeabe3f2ce2f63fe4a2ebf7.jpeg
Power Vs Force - Trường Năng Lượng Và Những Nhân Tố Quyết Định Hành Vi Của Con Người (Tái Bản),David R.Hawkins,Kiến Thức Bách Khoa,125300,2000,,https://salt.tikicdn.com/ts/product/37/54/79/b699efce8c0f4029f424019f561ef327.png
"Càng Kỷ Luật, Càng Tự Do",Ca Tây,Sách tư duy - Kỹ năng sống,74000,2000,,https://salt.tikicdn.com/ts/product/a3/57/75/7e17fd1bc79704272e6beba9968682c8.jpg
Chuyện Con Mèo Lập Kèo Cứu Sách,Natsukawa Sosuke,Truyện Giả tưởng - Huyền Bí - Phiêu Lưu,71400,2000,,https://salt.tikicdn.com/ts/product/17/70/9a/5ad6bb124699c08b6ff8e2971f8b2493.jpg
Giải Thích Ngữ Pháp Tiếng Anh (Với Bài Tập Và Đáp Án) (Tái Bản),Mai Lan Hương,Sách Học Tiếng Anh,151800,2000,,https://salt.tikicdn.com/ts/product/e1/04/31/7763d9035552760f627c34acfec0e12f.jpg
"Dear, Darling",Hiên,Truyện ngắn - Tản văn - Tạp Văn,61100,2000,,https://salt.tikicdn.com/ts/product/03/03/07/3fbe7cc39c9fe08b308274a03099c1c1.jpg
Thương Nhớ Mười Hai (Việt Nam Danh Tác) (Tái Bản),Vũ Bằng,Truyện ngắn - Tản văn - Tạp Văn,59400,2000,,https://salt.tikicdn.com/ts/product/92/f3/e0/83cda0f7600bd6e6644747c27ce6131d.jpg
Bộ sách Làm Giàu Từ Chứng Khoán (How To Make Money In Stock) phiên bản mới + Hướng Dẫn Thực Hành CANSLIM Cho Người Mới Bắt Đầu,William J. O’Neil,"Sách tài chính, tiền tệ",700000,2000,,https://salt.tikicdn.com/ts/product/16/02/ff/d8180a497eaf45bce49868b1af7be333.jpg
Gỗ Thần,Lưu Khánh Bang,Truyện trinh thám,67150,2000,,https://salt.tikicdn.com/ts/product/e7/61/3a/985d5ad2db9a3966a9013420954703d0.jpg
Tôi Nói Gì Khi Nói Về Chạy Bộ,Haruki Murakami,Truyện ngắn - Tản văn - Tạp Văn,59000,2000,,https://salt.tikicdn.com/ts/product/38/ca/e6/d2ef5065043a253429e6587f7b1bea57.jpg
Sức Mạnh Tiềm Thức (Tái Bản),Joseph Murphyc,Sách tư duy - Kỹ năng sống,84400,2000,,https://salt.tikicdn.com/media/catalog/producttmp/45/26/55/58d50e8dcd42e6ee0296008d823bd9b7.jpg
Nghệ Thuật Tư Duy Rành Mạch (Tái Bản),Rolf Dobelli,Sách tư duy - Kỹ năng sống,70800,2000,,https://salt.tikicdn.com/ts/product/ef/a6/94/70074b99dabd536696638bbf513401d4.jpg
Không Bao Giờ Là Thất Bại - Tất Cả Là Thử Thách (Ấn Bản Cập Nhật Đầy Đủ Nhất)(Bìa Cứng),Chung Ju Yung,Bài học kinh doanh,168800,2000,,https://salt.tikicdn.com/media/catalog/producttmp/b8/10/fd/0cef918a7aedb9ede38d46aeadc4bf2d.jpg
Mát Mát Lạnh Lạnh,Ngọc Bảo An,Truyện ngắn - Tản văn - Tạp Văn,43500,2000,,https://salt.tikicdn.com/media/catalog/product/m/a/mat mat lanh lanh.u547.d20160719.t104506.jpg
Bí Mật Của Naoko,Higashino Keigo,Tiểu Thuyết,64800,2000,,https://salt.tikicdn.com/media/catalog/product/u/n/unnamed--1-.u3059.d20170515.t104135.72047.jpg
Người Giỏi Không Phải Là Người Làm Tất Cả (Tái Bản),Donna M. Genett,Sách kỹ năng làm việc,38200,2000,,https://salt.tikicdn.com/media/catalog/producttmp/89/93/21/e82aabcdb76f43e2b80e00c6ac2e5717.jpg
Chiến Tranh Tiền Tệ - Tập 5,Song Hong Bing,"Sách quản trị, lãnh đạo",137000,2000,,https://salt.tikicdn.com/ts/product/27/fb/94/9c38c917a164600a498184d3d73c47f5.jpg
Monster #8 - Tập 6,Naoya Matsumoto,Monster #8 - Tập 6,49200,2000,,https://salt.tikicdn.com/ts/product/78/98/79/dbe0ea056cb4595fd6c56e1f3defa593.jpg
Thiên Môn Chi Thánh,Phương Bạch Vũ,Tiểu Thuyết,75000,2000,,https://salt.tikicdn.com/ts/product/5f/1b/40/567ded87612632ad92087ed52f42d587.jpg
Sức Mạnh Của Ngôn Từ (Tái Bản 2022),Don Gabor,Sách nghệ thuật sống đẹp,71200,2000,,https://salt.tikicdn.com/media/catalog/producttmp/f0/db/1c/98d137d24edbf7b6d5fedd365a4f4aa9.jpg
Blue Flag Tập 8 [Tặng Kèm Bookmark PVC],Kaito,Blue Flag Tập 8 [Tặng Kèm Bookmark PVC],45000,2000,,https://salt.tikicdn.com/ts/product/c5/0d/50/5dec744aead450eb1f72c2f2a7944eb0.jpg
Homo Deus: Lược Sử Tương Lai,Yuval Noah Harari,Lịch Sử Thế Giới,113400,2000,,https://salt.tikicdn.com/ts/product/f6/c4/c1/37cc7da534a3a25e39e4b5e32bf5f6ba.jpg
Lược Sử Tôn Giáo,Richard Holloway,Lược Sử Tôn Giáo,77400,2000,,https://salt.tikicdn.com/ts/product/5c/69/27/5a19171b7de6d9b6b2c4ecbf9c005f19.jpg
Mát Mát Lạnh Lạnh,Ngọc Bảo An,Truyện ngắn - Tản văn - Tạp Văn,43500,2000,,https://salt.tikicdn.com/media/catalog/product/m/a/mat mat lanh lanh.u547.d20160719.t104506.jpg
Giết Con Chim Nhại (Tái Bản),Harper Lee,Truyện dài,72000,2000,,https://salt.tikicdn.com/ts/product/f9/43/fe/c0f35edda6a18c65d638e731063b0cc1.jpg
Án Mạng Mười Một Chữ,Higashino Keigo,Truyện trinh thám,66000,2000,,https://salt.tikicdn.com/ts/product/32/2e/b7/fcd82c276d5e2a662ccadc1fb7e26cb4.jpg
Lâu Đài Bay Của Pháp Sư Howl (Tái Bản 2020),Diana Wynne Jones,Truyện Giả tưởng - Huyền Bí - Phiêu Lưu,63600,2000,,https://salt.tikicdn.com/ts/product/19/57/d2/f8e8ac1e83c74d24ef57d5e1a8194be7.jpg
Sapiens Lược Sử Loài Người (Tái Bản 2022),Yuval Noah Harari,Lịch Sử Thế Giới,191000,2000,,https://salt.tikicdn.com/ts/product/54/44/ec/20755ddad37cc1e7477f9a98aed12c77.jpg
Nàng Tóc Đỏ (Nobel Văn Chương 2006),,Tác phẩm kinh điển,66000,2000,,https://salt.tikicdn.com/ts/product/3d/3e/d8/bdc5a3edcd4ecd6bb91895ffb67cbe11.jpg
"Basic Economics: Kinh tế học cơ bản, a bờ cờ, kinh tế học nhập môn cho nhà đầu tư",Thomas Sowell,"Sách tài chính, tiền tệ",569000,2000,,https://salt.tikicdn.com/ts/product/13/63/d3/060916b287c4818f52386d82ec47a2cf.jpg
Hồ Sơ Tâm Lý Học Tâm Thần Hay Kẻ Điên,Mục Qua,Kiến Thức Bách Khoa,116180,2000,,https://salt.tikicdn.com/ts/product/b4/d6/9b/f5c06da78ec0835152a5eaa37f15cfb8.jpg
Tôn Tử Binh Pháp ( Tái Bản ),Tôn Tử,Kiến Thức Bách Khoa,45600,2000,,https://salt.tikicdn.com/ts/product/ee/10/85/c6baa8f0f71ebf5dd5a4f35657ffccf3.jpg
Chiến Tranh Tiền Tệ - Phần 1 - Ai Thực Sự Là Người Giàu Nhất Thế Giới ( Tái Bản 2022),Song Hong Bing,"Sách tài chính, tiền tệ",116000,2000,,https://salt.tikicdn.com/ts/product/c2/3a/64/feedafb39c7bc93f49277bef45f618d4.jpg
Gỗ Thần,Lưu Khánh Bang,Truyện trinh thám,67150,2000,,https://salt.tikicdn.com/ts/product/e7/61/3a/985d5ad2db9a3966a9013420954703d0.jpg
How The Body Works - Hiểu Hết Về Cơ Thể,Phạm Hằng Nguyên,How The Body Works - Hiểu Hết Về Cơ Thể,180000,2000,,https://salt.tikicdn.com/ts/product/b8/db/b7/7827a39c17b68337b093de7850fc3337.jpg
Nhà Đầu Tư Thông Minh (Tái Bản 2020),Benjamin Graham,Sách kỹ năng làm việc,119400,2000,,https://salt.tikicdn.com/ts/product/e2/bb/a0/cefa8cc641e90ccc6c32d81008ecff98.jpg
Người Giàu Có Nhất Thành Babylon (Tái Bản 2020),GEORGE SAMUEL CLASON,Bài học kinh doanh,64600,2000,,https://salt.tikicdn.com/media/catalog/producttmp/bc/e6/66/58b5c0c29a0bf405043d76111b254363.jpg
Đi khi ta còn trẻ,Trương Anh Ngọc,Tiểu sử - Hồi ký,72000,2000,,https://salt.tikicdn.com/ts/product/15/ec/9a/41b8847a26fda2ea02440becad908776.jpg
Franken-Stein Ở Baghdad,Ahmed Saadawi,Tiểu Thuyết,59200,2000,,https://salt.tikicdn.com/ts/product/d9/8b/7a/77ab2a7bfd0d048965be10f31b2eda12.jpg
Thợ Xăm Ở Auschwitz,Heather Morris,Tiểu Thuyết,88800,2000,,https://salt.tikicdn.com/ts/product/8e/5d/2d/c2a6038dd7f55a9295164e88c152f424.jpg
Đắc Nhân Tâm (Bìa Mềm)(Tái Bản),Dale Carnegie,Sách nghệ thuật sống đẹp,56700,2000,,https://salt.tikicdn.com/media/catalog/producttmp/44/24/18/3a611412495a443df6b5c236bfb723a3.jpg
Khoa Học Về Nấu Ăn - The Science Of Cooking,Stuart Farrimond,Sách Nấu ăn,210000,2000,,https://salt.tikicdn.com/ts/product/15/d4/d5/70ad904b07a46853d61af141185078f5.jpg
Chuyện Đi Làm Hết Lòng,Na Lê,Sách nghệ thuật sống đẹp,116000,2000,,https://salt.tikicdn.com/ts/product/8c/29/9c/4947bec1c2181534beaceceac527c03d.jpg
Luật Hấp Dẫn - Quy Luật Về Sức Mạnh Của Linh Hồn Và Năng Lượng Chữa Lành Cơ Thể Từ Bên Trong,Prentice Mulford,Sách tư duy - Kỹ năng sống,90200,2000,,https://salt.tikicdn.com/ts/product/16/7f/b4/3acce05b023d7b7d2ede09ffeed93077.jpg
Người bà tài giỏi vùng Saga – Tập 9,Yoshichi Shimada,Người bà tài giỏi vùng Saga – Tập 9,43000,2000,,https://salt.tikicdn.com/ts/product/82/79/23/5c523ab19fbf15d457766c9c74160268.jpg
"Trong Cái Không Có  Gì Không ? (Thiền Sư Thích Nhất Hạnh Trả Lời Cho Trẻ Em Những Thắc Mắc Về Ý Nghĩa Cuộc Sống, Về Cái Chết, Về Gia Đình, Bạn Bè Và Nhiều Câu Hỏi Khác)",Thích Nhất Hạnh,Sách nghệ thuật sống đẹp,130000,2000,,https://salt.tikicdn.com/media/catalog/producttmp/2f/98/3b/886c5c62535c8877d9c65c40c19a0947.jpg
Payback Time - Ngày Đòi Nợ,Phil Town,Bài học kinh doanh,299000,2000,,https://salt.tikicdn.com/ts/product/64/cd/ba/c12f6fca49de9767c6c167c0030f7985.png
"Think And Grow Rich - 13 Nguyên Tắc Nghĩ Giàu, Làm Giàu (Tái Bản)",Napoleon Hill,Sách kỹ năng làm việc,77000,2000,,https://salt.tikicdn.com/ts/product/0b/cd/50/9c219e191737b2757911b962eeb54c2c.jpg
How Management Works - Hiểu Hết Về Quản Lý,DK,"Sách quản trị, lãnh đạo",262000,2000,,https://salt.tikicdn.com/ts/product/60/e9/bf/9f1a21104614cbd0727c429c7c783e37.jpg
Lược Sử Thế Giới,E.H. Gombrich,Lịch Sử Thế Giới,192000,2000,,https://salt.tikicdn.com/ts/product/34/89/f6/184559a254d35ad99973d24bae54c14c.jpg
Combo 2 Cuốn : Dám Bị Ghét + Dám Hạnh Phúc,Kishimi Ichiro,Sách tư duy - Kỹ năng sống,119480,2000,,https://salt.tikicdn.com/ts/product/6b/f7/cf/0112d66224339baa47b1c1fd4b493e67.jpg
Không Sợ Chậm Chỉ Sợ Dừng ,Vãn Tình,Sách nghệ thuật sống đẹp,83001,2000,,https://salt.tikicdn.com/ts/product/ba/46/bb/b502c436b2a4d3132804155a778cd798.jpg
Kiếp Nào Ta Cũng Tìm Thấy Nhau: Câu Chuyện Về Những Linh Hồn Tri Kỷ Vĩnh Viễn Không Chia Lìa (Tái Bản),Brian L Weiss,Kiếp Nào Ta Cũng Tìm Thấy Nhau: Câu Chuyện Về Những Linh Hồn Tri Kỷ Vĩnh Viễn Không Chia Lìa (Tái Bản),69300,2000,,https://salt.tikicdn.com/ts/product/6e/55/77/a0a404fb849d8af3ab4a0f6fe636c329.png
Chủ Nghĩa Khắc Kỷ - Phong Cách Sống Bản Lĩnh Và Bình Thản,William B. Irvine,Kiến Thức Bách Khoa,87500,2000,,https://salt.tikicdn.com/ts/product/97/61/91/a9b293f184d4dbbc2afc416b539f2bca.jpg
Storytelling With Data - Kể Chuyện Thông Qua Dữ Liệu (Cuốn Cẩm Nang Hướng Dẫn Trực Quan Hóa Dữ Liệu),Cole Nussbaumer Knaflic,Sách kỹ năng làm việc,223000,2000,,https://salt.tikicdn.com/ts/product/d0/63/8b/b083084e4bdf5da0a5db725398627cc4.jpg
"Nghệ Thuật Tập Trung - Nâng Cao Năng Suất, Tối Ưu Thời Gian, Hiệu Quả Bất Ngờ",Nhà tâm thần học DaiGo,Sách tư duy - Kỹ năng sống,70100,2000,,https://salt.tikicdn.com/ts/product/54/bd/9c/0bbe884b7f99a5b36435a3bf8a3402ee.jpg
OSHO - Yêu - Being In Love,Osho,Sách nghệ thuật sống đẹp,110800,2000,,https://salt.tikicdn.com/media/catalog/producttmp/0e/24/f9/f35175e797308af4f005a101d2bdfa9d.jpg
Tìm Mình Trong Thế Giới Hậu Tuổi Thơ,Đặng Hoàng Giang,Sách Tâm Lý Tuổi Teen,85200,2000,,https://salt.tikicdn.com/ts/product/80/fd/b5/999460db5daf4fef7d8e61529eec43b6.jpg
Hãy Khiến Tương Lai Biết Ơn Vì Hiện Tại Bạn Đã Cố Gắng Hết Mình (Tặng Kèm: 01 Bookmark),Bạch Tô,Sách tư duy - Kỹ năng sống,64001,2000,,https://salt.tikicdn.com/ts/product/6f/a1/9b/cdb06e4dfe576e20b4517b48e33ee141.jpg
Luật Hấp Dẫn (Tái Bản),,Sách tư duy - Kỹ năng sống,53400,2000,,https://salt.tikicdn.com/ts/product/20/e6/13/5167a6f3962041dcb27cf7bc0e13b7b9.jpg
Muôn Kiếp Nhân Sinh (Many Lives - Many Times),Nguyên Phong,Muôn Kiếp Nhân Sinh (Many Lives - Many Times),110800,2000,,https://salt.tikicdn.com/media/catalog/producttmp/a6/27/7d/1ceb55698f6761233baa6874207af46f.jpg
48 Nguyên Tắc Chủ Chốt Của Quyền Lực (Tái Bản 2020),Robert Greene,Sách tư duy - Kỹ năng sống,161000,2000,,https://salt.tikicdn.com/ts/product/c5/2d/9b/246d06f4ceee964a87ac4bcc2c6b3138.jpg
Blue Period - Tập 06,Yamaguchi Tsubasa,Blue Period - Tập 06,41700,2000,,https://salt.tikicdn.com/ts/product/28/c9/e8/e986d2ee766d21c3f41b845605677a5c.jpg
